QueryText,KccAns
fertilizer in  groundnut  crop,A plant must be unable to complete its life cycle in the absence of the mineral elementThe function of the element must not be replaceable by another mineral elementThe element must be directly involved in plant metabolism These criteria are important guidelines for plant nutrition but exclude beneficial mineral elements Beneficial elements are those that can compensate for toxic effects of other elements or may replace mineral nutrients in some other less specific function such as the maintenance of osmotic pressure The omission of beneficial nutrients in commercial production could mean that plants are not being grown to their optimum genetic potential but are merely produced at a subsistence level This discussion of plant nutrition includes both the essential and beneficial mineral element
Farmer asked Varieties information of Ground nut crop,:-  :-  -     :-  -  -  -
Information about nutrient management in Groundnut,20    10
ask about white grub in ground nut,I suggested to give foret 10 kgha at time of sowing for white grub in ground nut
TIKKA LEAF SPOT IN GROUNDNUT,TIKKA LEAF SPOT IN GROUNDNUT RECOMMENDED TO SPRAY SAAF 2 GRLT WATER
VARIETIES FOR  G NUT    ---,VARIETIES FOR  G NUT    --- TAG - 24  TAG- 26
Ask about fungus problem in groundnut crop,EC -
pest attact in ground nut,RECOMMENDED TO SPRAY CHLORIPYRIPHOS 500 MLAcre
Asking about Stem and root rot management in Groundnut,:      :  1     20
leaf spot in groundnut,spray mancozeb2gmlit of water
FOR BLOOSMING,Spray Boom flower 20ml DeviCropscience15 liter of Water
Asking about suitable varieties for Groundnut Purattasipattam,Recommended for TMV 7 VRI 2 VRIGn 6TMVGn 13
farmer ask about seed tare of sesamum groundnut green gram black gram bajra sorghum maize paddy crop,Paddy:12kgAcre
karapa,kocide 20  gm 15 ltr water
tell me mandi rate of groundnut,mandi rate of groundnut gg-20 chitra m-13
Asking about Leaf miner sucking pests and Alternaria leaf disease management for Groundnut,:             :  2   2  1
wilt,blitax 3gmlit
Farmer asked query on Weather,120       l
seed treatment in ground nut,Treat with Chloropyriphos 65 ml  imidacloprid 2 ml  mancozeb 3 grKG Seed
Asking about  Difference between Boron vs Borax,:        :
TELL ME WEATHER REPORT IN BARMER,NO RAIN POSSIBILITY IN NEXT 5 DAYSCLOUDLY SKY
FARMER ASKED ABOUT VARIETIES OF GROUND NUT CROP,-             -    -
Asking about top fertilizer management for groundnut,:            :  -     -
ask about fungus problem in Groundnut,wp                    WP
GIPSUM FERTILIZER INFORMATION,CL FERTILIZER DOSES
moongfali me uktha rog ke liye kya kare,carbandazim 20 gramliter pani  mencozeb 10 gramliter pani ka spray kare
Farmer asked query on Weather,SRI-DUNDARGARH                  -
Farmer asked about blight attack on groundnut,30          WP
TELL ME TIKA CONTROL IN MUNGFALI,SPRAY OF MENCOJEB 2GM PAR LITAR WATER
Farmer asked Sucking pests and Larvae problem in ground nut crop,25- 40
Asked about  leaf caterpillar thrips  Leaf spot disease in groundnut crop,:           :  2    2
Asked about herbicide waiting period information,:          :
Information about in Variety in ground Nut,-44 -86
Farmer asked Larvae and Sucking pests control information of  Groundnut Crop,126    95  ZC
Asked about Foliar spray for Groundnut planofix can be spray,:        : TNAU   2  200
BLIGHT DESEASE,SPRAY MANCOZEB2MLLITER OF WATER
Farmer wants to know information about How to control of fungal attack in groundnut crop,Recommended for to control of fungal attack in grountnut  crop use thiophinate mithyl 25 gram and streptocyclin 2 gram at 15 liter of water
TELL ME WEATHER INFORMATION OF PALI,NO RAINFALL NEXT FIVE DAYS OF PALI
Tell about information Seed treatment of Groundnut,50 WP  2-3
Ask about Blank pod control in Ground nut,::
leaf spot,kavach 400grm acre
MUNGI FALI KI JARE ME KIT HAI,CARTAF HYDROCLORAID 4G 8 KGACRE KE HISAB SE BIKHER DE
GROUNDNUT SUCKING PEST MANAGEMENT,40     150
Asking about Root  rot management in groundnut,:       : :    25
Asking about leaf caterpillar and beetle management in groundnut,:          :     2
TELL ME WEATHER INFORMATION OF,NO RAINFALL NEXT FIVE DAYS
Asking about top fertilizer management for groundnut,:   :      5   20
ASKING ABT FER IN GNUT,I HAVE SUGGEST DAP
GROUND NUT LEAF EATTING CATTERPILLER,RECOMMENDED SPRAY QUINOLPHOS 400MLACRE
Please give me weather information,Aapke yahan 2 June se 6 June tak barish hone ki sambhawna hain
APHIDS IN GROUNDNUT,Spray Dimethoate 30 EC  17 mllit water
Farmer wants to know information about How to control of white grub attack in ground nut crop,Recommended  for to control of white grub attack in ground nut crop plz drench the field with chlorpyriphos
VARITIES OF GNUT,VARITIES OF GNUT - SB -11  TAG-24  WESTARN
YELOWING IN G NUT,SULFER 5 KGBIGHA
Farmer wants to know about fertilizer in groundnut,20
ground nut tikka leaf spot management,ground nut tikka leaf spot management :  RECOMMENDED TO SPRAY HEXACONAZOLE  400 ML PER ACRE
SUCKING PEST CONTROL AND FUNGAL CONTROL IN GROUND NUT,SPRAY NEEM OIL  2ML WITH MANCOZEB 3GM IN 1LTR OF WATER
ASK ABOUT FERTILIZER IN CASTOR,SUGGEST:TO GIVE UREA
Information regarding fertilizer in groundnut crop,50   27
ground nut sucking pest,RECOMMENDED TO SPRAY PROCLAIM 90GRAMS PER ACRE
Weather in Etah distt,kisan bhai apke yaha 14 se 20 august tk halkee barish hone ki sambhawana hai
Ask about varieties of Summer groundnut crop,: --
FARMER ASKED QUERY ON FERTILIZER MANAGEMENT IN GROUNDNUT,RECOMMENDED THAT GYPSUM 200 KG  ACRE
ASKED ABOUT TO WATER MANAGEMENT IN GROUNDNUT,25  30
fertilizer information at 45 days,no requirnment
TELL ME ROOT  ROT DISESE CONTROLL IN GROUNDNUT,APPLIED BAVISTIN 250 GM BIGHA  WITH IRRIGATION WATER
disease,carbondizium 2gmlit
TO CONTROL ATTACK OF GREEN CATERPILLAR,SPRAY CHLOROPYRIPHOS 25 ML IN 10 LTR OF WATER TO CONTROL ATTACK OF GREEN CATERPILLAR
TELL ME DISEASE CONTROL IN GROUNDNUT,-- 2
alternaria blight in ground nut,spray copper oxychloride 3 gram in 1 litre water
ask about sowing time,June-July Jan-Feb
Information about Vareity of Ground nut crop,--37 A     -13
ask abt white fungi,I suggested tricodarma
ASKING ABOUT VARIETY OF GROUNDNUT,-   -  -    -
tobacco caterpillar in groundnut,spray quinalphos 2 ml  neem oil 3ml  teepol 1ml  lit of water
Asking about Groundnut leaf miner management,recommended for the spray  :dimethoate 2 ml lit of water
Farmer asked termite control information of groundnut crop,EC
GROUND NUT RUST,RECOMMENDED TO SPRAY CHLOROTHALONIL 400 GRAMS  ACRE
Whitefly in Groundnut,recommended for spray panchagavya 30 ml  liter of water
ASKED ABOUT TO INSECT CONTROL IN  GROUNDNUT  CROP,50    15
Groundnut Alternaria leaf desease,Recommended for spray  Copper oxy chloride 2 g  litre of water
Ground nut leaf miner,recommended for spray profenophos 2 ml teepol 1 mlliter of water
ask about irrigation,suggested first irrigation suddenly after sowing and second irrogation afetr 7-8 days then third after 4 weeks
THANKS FOR CALLINGPLEASE CALL AGAIN,THANKS FOR CALLINGPLEASE CALL AGAIN
HERBICIDE IN GROUNDNUT,HERBICIDE IN GROUNDNUT- PURSUIT 2 MLLIT
WEED MANAGEMENT IN GROUNDNUT,RECOMMENDED TO SPRAY PROPAQUIZAPOP 250 ML  ACRE
GROUND NUT LEAF EATING CATERPILLAR MANAGEMENT-,GROUND NUT LEAF EATING CATERPILLAR MANAGEMENT-RECOMMENDED TO SPRAY EMAMECTIN BENZOATE  90 GRAMS 200 LITERS OF WATER  ACRE
provide about information of fertilizer in groundnut crop,- 8   20    18
ALTERNARIA LEAF BLIGHT,SPRAY MANCOZEB 2 GRAM PER 1 LTR WATER
asked about seed treatment in groundnut,seed treatment in groundnut -use thiram 2 gram   1 kg of seed before sowing
WEEDICIDE APPLICATION BY THAT AFTER RAINING,CAN APPLICATION
Asking about Micro nutrients mixture applied for Groundnut,:     :
FARMER ASKED QUERY ON TEBUCONOZOLE USES,RECOOMENDED THAT USED FOR  RUST FUNGUS SHEATH BLIGHT  LEAF SPOT
Farmer asked about fertilizer dose in groundnut crop,-
Asking about foliar nutrient spray for groundnut,Recommended for spray Panchakavya 30 ml  litre of water
WEED MANAGEMENT IN GROUNDNUT CROP,40  200
SUCKING PEST IN GROUNDNUT,RECOMMENDED TO SPRAY ROGOR  25 ML  1 LIT OF WATER
information regarding how to control of termite in Mungfali,broadcast cloropyriphos  15 lt in 20 kg sand per acre
TO CONTROL ATTACK OF RUST IN GROUNDNUT CROP,SPRAY REDOMIL GOLD 25 GM IN 10 LTR OF WATER TO CONTROL ATTACK OF RUST IN GROUNDNUT CROP
insect problem in ground nut,aap Quinalphos 25 EC ki 2 ml matra ko prati liter paani ki dar se milaker spray kar de
Farmer asked  Fertilizer dose information of Groundnut crop,-  -- -
Nutrient management,RECOMMENDED TO SPRAY AGROMIN MAX 3 GR1 LITRE OF WATER
asked about sowing season of groundnut,:       :     -      -
FARMER ASKED QUERY ON PEGGING STAGE  MANAGEMENT IN GROUND NUT,RECOMMENDED TO APPLY ZYPSUM -20 KG20 CENTS IN GROUND NUT
Ask for problem in ground nut,Suggest Tricoderma Virdi application
I WANT TO SOIL TESTING,CONTACT TO NEAREST AG OFFICE
foiliar spray of groundnut rich,foiliar spray of groundnut rich 3kgac
TELL ME ABOUT DOSE OF SULPHUR IN GROUNDNUT CROP,3
weed control in mugfali,parsud  daba dalia
Farmer asked query on Weather,:        :        35        15
Ask about weather,possibility of rain fall
Whitefly in Groundnut,recommended for spray dimethoate 2 ml liter of water
Asked about groundnut foliar nutrition management,:         :    5   1       5
bud necrosis management in groundnut,recommended for dimethoate 2 ml 1 litre of water
pest,dimethioate 15 ml 1 liter
grounut bacterial blight,cupper oxy chloride 3g per liter of water and streptocyclin 05 g
Information about termite control in groundnut crop,Fipronil 03 GR  8-10
TELL ME ABOUT WEATHER INFORMATION,HAVI  RAIN POSSIBILITY IN NEXT 5 DAYS
uinsecet controll in wheat,3   10
ground nut sucking pest control measurs,RECOMMENDED TO SPRAY PROPINOPHOS CURECRON PROFEXDON BOLERO  400 ML PER ACRE
white grub aatack in groundnut,Phorate 10 CG  8 kilo  acre
Asked about leaf cater pillar management in groundnut,:    :
Information about nutrient management in groundnut,8  10
management of groundnut fertilizer,recommended to apply 9 kg urea and 200 zypsum per acre
leaf eating caterpillar in groundnut,recommended to spray chlorpyriphos-2mllit of water
Ask about Fertilizer dose of Groundnut crop,--   -
ground nut sucking pest,RECOMMENDED TO SPRAY DIMETHOATE 400MLACRE
Ask about variety information in Groundnut crop,-              -
ASKING ABOUT CONTROLL OF WILT ATTACK,SPRAY RIDOMIL GOLD 30 GM  15 LITERS OF WATER
farmer ask about kranti variety of groundnut crop,-    -                                        98     -  -  -  -
TELL ME ABOUT TERMID  CONTROL IN GROUND NUT,SPRAY OF FIPROLIN 5  2 LITER PER HA
Farmer asked weed control in groundnut crop,80
Farmer wants to know information about Weed Management in Groundnut crop,-
want to know about weather report information,possibility of rain and drezzils in the date of june 21 to june 26
ASKED  ABOUT TO  DISEASE CONTROL IN  GROUNDNUT,12   63    2
Farmer asked query on Weather,3      26     10
FARMER ASKED QUERY ON NUTRIENT MANAGEMENT IN GROUNDUNT,RECOMMENDED TO APPLY ZYPSUM-200 KGACRE
how to control stem rot  in ground nut crop,2kg tricoderma viridi mix with 50kg compost and apply in field
farmer want to know information about govt schemes,recommended for to know about govt schemes please contect rural agriculture extension officer
Asked about caterpillar  beetle management in groundnut,:     : :      15
Farmer asked query on Weather,41       14
Asked  about   to  fertilizer  use   of  groundnut,375            35
FLOWER DROP,SPRAY PLANOFIX 3 MLBayer15 LITER WATER
Asking  about  aphids and caterpillar management in groundnut,:       : :     2   1
Asking for Groundnut 2nd irrigation,Suggested to irrigate after the proper germination occurAprrox20DAS
groundnut varieties,groundnut varieties--ankurtag 24sb11
Asked about storage of Groundnut seeds after harvest,:         :
TELL ME SEED TREATMENT GROUNDNUT,USE CHLOROPYRIFOS 20 EC 4 ML PER KG SEED FOR SEED TREATMENT IN GROUNDNUT
moongphali me phal nahi lagte,planofix20 mlli water
LEAF BUD,RECOMMENDED TO SPRAY MONOCROTOPHOSNUVACRON PHOSKIL LUPHOS 300 ML PER ACRE
TELL ME CONTROL OF FLOWER DROPPING IN GROUNDNUT,1    4
ASKED ABOUT FERTILIZER DOSE OF GROUND NUT,ADVICE SOIL TEST AND CONTACT WITH ADAKPS BLOCK
GROWTH PROMOTER,SPRAY BAOZAIM2MLLITER OF WATER
groundnut fertilizer usage,groundnut fertilizer usage : application of gypsum 200 kilogram at 45 days after transplantation
root rot management,--RECOMMENDED TO DRENCH COPPER OXYCHLORIDE  BLITOX 3 GRAMS  1 LITRE OF WATER    3
TELL ME WEATHER INFORMATION OF BARMER,RAIMFALL 15 MM NEXT FIVE DAYS OF BARMER
ATTACK OF WHITE GRUB,Drenching of Chloropyriphos 40 ml  15 lit of water
Asking about Groundnut leaf miner management,:        :       1 5
Tobacco caterpillar control in groundnut,Recommended for spray profenophos 15 ml  acephate 1 g  liter of water
asking about top fertilizer management for groundnut,recommended for apply Gypsum 100kg borax 4kgac
FERTILIZER APPLICATION IN GROUND NUT,RECOMMENDED TO APPLY UREA-10KG AND MOP-30KGACRE
white grubs,Use Fertera 4 kg acre
ABOUT COLER ROT IN GROUNDNUT,COLLER ROT CONTROL IN GROUNDNUT 25 KG TRIGODRMA 100 KG FYM PER HA DRANCHING
urea doses in groundnut,11kg urea per bigha
TELL ME CONTROL OF NSECT IN GROUNDNUT,SPRAY OF TRIZOPHOS 40 EC 2 ML PER LITER WATER
asking about groundnut top dressing fertilizer application,recommended for apply gypsum 75 kg  borax 4 kg  acre
FOR BLACK SPOT CONTROLE IN GROUNDNUT,SPRAY OF  CARBENDAZIM 12   MANCOZEB 63  WP 2 GRAM PER LIT WATER
Askingb about groundnut jassids management,Recommended to spray neem oil 2mllit of water
GROUNDNUT THIKKA LEAF SPOT DAMAGE,RECOMMENDED TO SPRAY CHLOROTHALONIL 400 GRAM  ACRE
moongphali par kala dhabba ban raha hai tikka desese,kopar oxi kloraeid 2 gram dawa liter pani milakar sprey kare
Attack of Caterpillar,Spray Decis -15 ml15 liter water
Farmer asked about clorpyriphos 10 GR,G
asked for ground nut pest control,asked for ground nut pest controlrecommended- acephate 2 gm per liter
asked about attack of wilt in groundnut,Spray Redomil Gold 45 gm15 Liter of WaterMephonaxonMancozeb-Syngenta
ground nut Alternaria leaf disease management details,recommended for spray  Copper oxy chloride 2 g  lit of water
GROUND NUT  VARITES,K -6
Ask about termiteNematodwhite grub control information,Suggested: Phorate 10 G 2 kgvigha
TELL ME CATERPILLAR CONTROL,SPRAY OF PROFENOFOS 15 ML PER LITER WATER
FARMER ASKED FOR GROUND NUT VARIETY,FARMER ASKED FOR GROUND NUT VARIETY VARIETY OF GROUNDNUT -TAG-24 TG-
ask abt fungal problem,suggested thiram 3gm1kg seed
TELL ME ABOUT CONTROL OF YELLOWING LEAF IN GROUNDNUT,SPRAY OF FERUS SULPHATE 5 GM  CITRIC ACID 1 GM PER LITER WATER
yellowing of leaves of gnut,spray Feso4  1
TELL ME GROWTH IN GROUNDNUT,UREA 4KGBIGHA
Asked about Plant protection in Groundnut,Recommended to spray Carbendazim 2 g  1 litre of waterRecommended to spray SAAF  mancozeb  carbendazim 1 g per litre of Water
ASK ABOUT BIO- INECTCIDE IN GNUT,80-100 GRAMPUMP SPRAY
PL TELL ME YELOWING IN GROUNNDUT CROP,USE-FERAS-SALFETH 5GRAMLITERWATER BY SPRAY
root problem of groundnut,DRENCHING OF TRAICODARMA 25 KG WETH FYM 72 KG PER HE
LEAF SPOT IN GROUNDNUT,RECOMMENDED TO SPRAY SULPHUR 4GM LIT WATER FOR CONTROL OF LEAF SPOT IN GROUNDNUT
Groundnut planting time,15   15
TIKKA DISEASE,TIKKA DISEASE : SPRAY MANCOZEB 75 WP 4 GM PER LITRE OF WATER
ask about ground nut larva,i suggest spray monocrotophos 30 gm  pump
varity of paddy,pusa basamati
ground nut fertilizer management,recommended to apply urea 30 kg  gypsum 200 kg acre
ASKED ABOUT TO WEED CONTROL IN  GROUNDNUT,30     25
weedicidein groundnut,RECOMMENDED TO SPRAY IMAZITAPYR PURSUIT  400 ML PER ACRE
Asking about Groundnut foliar spray application,:       :  TNAU    2    200
PLANT PROTECTION IN GROUND NUT,MANCOZEB  2ML PER LITER
varieties of ground nut,varieties of ground nut - TAG - 24  SB - 11
Farmer asked about sucking pest attack on groundnut,15
Ask about fungus problem in Rootof groundnut crop,50     250            WP
fertilizer management for groundnut,apply gypsum 150 kg  acre on 40 th day
Farmer asked leaf spot  control information of groundnut crop,EC 35-
Asking about leaf spot in Ground nut,Recommended for spray Carbendasim 2 gram litre of water
Wilt disease in groundnut,Hexaconazole 5 EC  400 mlAcre spary kre
GROUNDNUT CATERPILLERCONTROL,CHLORIPYRIPHOS 500 MLAcre
ASKED ABOUT TO INSECT CONTROL IN GROUNDNUT,50   1   10
asked about weather information,Partly cloudy no chances of rain
Farmer asked query on Weather,27            10
top dressing for ground nut,apply gypsum 80kgac 40th days after sowing
Asking about groundnut top dressing fertilizers,:   :  - 75    - 4
Farmer asked organic Fungus control in Groundnut crop,-
moong fhali mein weed control,nirai gudai karein
drenching blue coper25gmlit,drenching blue coper25gmlit
Aphids in ground nut,Recommended  to spray methyl demeton 25ec  2 ml per 1 liter of water to control Aphids in ground nut
information regarding for control of thrips and jassids in sarson,spray of alica 80 ml in 120 litre of wateracre
Asking about Tobacco caterpillar management in groundnut,:       : 10      4
fertilizer,05234microlla
LEAF CURLING IN GROUNDNUT,SPRAY QUINOLPOS  400 ML  ACRE
asking about weather details,Today No Rain Fall
Weather Condition,Overcast and light rainPrecip chance: 85Humidity: 88
whitegrab control,give cloropayriphos 25 litha
Capsule borer in Sesame,Recommended for spray profenophos 2 ml litre of water
SUCKING PESTS IN GROUNDNUT,SPRAY IMIDACLOPRID 1 ML IN 3 LITRE IN WATER FOR SUCKING PESTS IN GROUNDNUT
Asking about leaf spot in groundnut,:      :  2
Farmer asked fertilizer dose in gnut,10  12
Ask about PGR AND PGP gnut   Information,004 wW  -
--Information regarding varities of groundnut,:  -4    -4     -1
Asking about Sucking pest and Leaf spot management in groundnut,Recommended for spray Dimethoate 2 ml  Carbendazim 2 gram litre of water
fertilizer uses,Recommeded to apply DAP Sulphur and Potash as basal
PROBLEM OF YELLWOING IN   GROUNDNUT CROP,USE--FERAS-SLFETH  5GRAM LITERWATER BY SPRAY
TELL ME CONTROL BLACK ROOT ROT IN GROUNDNUT,USE TEBUCONAZOLE 1 LITER PER HA WITH IRRIGATION
TELL ME SOLOUR SUBSIDY IN GENRAL,60SUBSIDY IN SOLOUR
ASKED ABOUT TO NUTRIENT MANAGEMENT IN GROUNDNUT,375     35
Attac  of Catterpilar,Sprey Profex Super 30 ml  15 lit of water
ASKED ABOUT TO DISEASE CONTROL IN  GROUNDNUT,75    2
ROOT ROT IN GROUNDNUT,RECOMMEND FOR GINEB 78 PERCENT 600 GM ACRE IN GROUNDNUT
How to control of fungal attack in groundnut crop,Use copper oxy chloride 45 grampump
GROUNDNUT LEAF FOLDER MANAGEMENT,GROUNDNUT LEAF FOLDER MANAGEMENTRECOMENDED TO SPRAY MONOCROTOPOS1 6 MLL OF WATER
ask for basal fertilizer information,suggest:give DAP and MOP as a basal fertilizer
tikka attack on groundnut,Blue copper -40 gm 15 lit water
Farmer asked about wilt control in pea nut crop,15
Farmer asked query on Weather,5                        30    24
moongfali me pani bharne se pili ho rahi hai kya kare,urea ke sath zinc ka prayog kare
LATH IN GNUT,REJENT 2KGBIGHA
Farmer asked about water management in groundnut,-                          -                         -
LEAF BLIGHT IN GROUNDNUT,RECOMMENDED SPRAY METALAXYL-MANCOZEBRIDOMIL 25GMLTR WATER FOR LEAF BLIGHT IN GROUNDNUT
STEM ROT IN GROUND NUT,RECOMMENDED FOR 30 gr COPPOR OXY CHLORIDE AND 1 gr STREPTOCYCLIN  IN 10 ltr of WATER
Groundnut Tobacco caterpillar,Recommended for spray profenophos 2 ml  lit of water
ground nut richi detail,ground nut richi 2 kg  200 litre of waterac
ATTACK OF SUCKING PEST OF GROUNDNUT,-             30         WP
ROOT ROT IN GROUNDNUT,SPRAY SAAF 2GM WITH PLANTOMYSIN 1GM IN 1 LTR OF WATER
tell me about cron rot in groundnut,DRENCHING OF CARBENDAZIM 1 KG PER HA IN ROOT ZONE WITH IRRIGATION
asking about Leaf caterpillar management in groundnut,Recommended for spray CartapHydrochloride 50  SP 15 ml  litre of water
GROUNDNUT MICRO NUTRIENT DEFICIENCY,RECOMMENDED TO SPRAY FORMULA-4 1 KG  ACRE IN 200 LITRE WATER
Asking about gnut irrigation,Suggest to give after loss of moisture moisture from soil
Ask about seed treatments of Termite of groundnut crop,EC
Farmer asked weed control in Groundnut crop,--      30 EC          -  -
ask for gnut wilt control,I suggested to drenching coc 40 gmpump
aphid problem in groundnut,kisan bhai mungfali me mahu ke liye imidaclorprid 178  SL 05 mlliter pani me  spray kare
Asked about plant protection in  ground nut,Recommended to spray dimethoate  2ml per lit of water
Asked about Nutrient management in Groundnut,Suggested to apply Gypsum  150 kg per acre
Attack mily bug,Decis -4 ml15 liter water
Fertilizer use in Groundnut,Recommended to apply Gypsum  100kg per acre after 25 days of planting in groundnut field
Asked about plant protection in GROUNDNUT,Suggested to spray Quinolphos 2mlltr of water
asking about Groundnut spacing information,:       :   30   10
groundnut thrips,tryzophos  20  ml per pump and to spray
Farmer asked query on Weather,-
varieties of groundnut,-- -
GROUNDNUT STEM ROT,RECOMMENDED  TO DRENCH  COPPER OXY CHLORIDE  3 GRAMS  LIT OF WATER
plant protection,phosalone 2ml per liter of water
ASKING ABOUT SOWING TIME OF GROUNDNUT,SOWING FROM 20 JUNE - 1ST WEEK OF JULY
CALOR ROOT IN GROUNDNUT,USE TRICHODERMA 25 KG PER 100 KG COW DUNG
Farmer asked query on Weather,:   -     : :            36  C    26 C     8
ground nut leaf eating caterpillar management,RECOMMENDED TO SPRAY EMAMECTIN BENZOATE  90 GRAMS 200 LITRES OF WATER  ACRE
want to know about weather report information,cloudy Weather rain and drizzles in the date of july 5 to july 11
Weather forcast for groundnut crop,Kisan Bhai apke kshetra me 04 july se 07 july tak halki barish ki sambhavna hai
APHID PEST IN GROUNDNUT,RECOMMENDED TO SPRAY DIMETHOATE  ROGOR 2ML LIT WATER FOR CONTROL OF APHID PEST IN  GROUNDNUT
ASKING ABOUT GROUND NUT SPRYING,PLANTING MATERIAL
Information regarding varieties of Groundnut,Information regarding varieties of Groundnut mh-4punjab moonfali -1
groundnut top dreesing management,recommended for apply urea 25kgpottash 10kgacr
TELL ME VAREITY OF GROUNDNUT,SPRAY OF  FIPRONIL 5 SC 2 LITER PER HA
groundnut seed treatment,:-
VARIETY OF GROUNDNUT,VARIETY OF GROUNDNUT- TAG-24 SB-11PHULE PRAGATI
FARMER ASKED QUERY ON WEED MANAGEMENT IN GROUND NUT AT 45DAYS,NOT RECOMMENDED
Ground nut verities,Explained
ASKING ABOUT VARIETIES IN GROUNDNUT,RECOMMENDED FOR VARIETIES -SOMNATH JL-24MH-2
Farmer want to know how to control sucking pest of groudnut crop,Recommended for spray Fipronil 5   30 ml per 15 litter water
plant protection,imidachloprid 03mll of waterquinolphos 2mll of water
Farmer Asked sucking pests control information of GROUNDNUT,ZC 8
ask about wilt in gnut,Blue copper 40 gmpump AND DRENCHING
TELL ME PEST CONTROL OF GROUNDNUT,25  05
groundnut  root knot nematode,Recommended for groundnut root knot nematode Apply carbofuran 5kg  sand 20 kgac
GROUND NUT LEAF EATING CATER PILLAR MANAGEMENT,RECOMMENDED TO SPRAY SPINOSAD 75 ML200 LITRES OF WATER  ACRE
TELL ME INSECT CONTROL IN GROUNDNUT,USE IMIDACHLOPRIED 178 SL 1 LITTERHAC WITH IRRIGATION
ask about fertilizer dose in groundnut crop,- ---        20-25
momfali me kherpatwar hi,nirai gudai karein
Asked about Stem rot Management for Groundnut,:        :    Nativo
Basal fertilizer management for groundnut,apply DAP 5Okg  gypsum 75 kg ac
Ask about sucking pests problem in crop,Suggested: Imidacloprid 305  sl 4 mlpump  spray
Tobacco caterpillar in groundnut,Recommended for spray Chlorpyriphos  2 ml  litof water
ASKING ABOUT VARITIES OF GROUNDNUT,GROUNDNUT PHULE PRAGATIKOPARGAON
about management of the ground nut leaf folder,RECOMMENDED TO SPRAY CHLORPYRPHOSKORBAN DURSBAN LETHAL CLASSIC RADAR 500 ML PER ACRE
Weather information,There is a possibility of heavy rain in your area this week till 1 august
Ask about seed treatments of white grub of groundnut crop,EC
control of blight attack,spraying of ridomil gold and after that use isabion
USE CHLOROTHELONIL 25 GM PER KG SEED,JATAYU 25
Farmers query about yield of groundnut,Information provided by kcc   yield of groundnut  15 - 20 quintal per hectare
GROUNDNUT SB-12 VARIETIES DETAILS,--  - - --      -    -
plant protection,chloropyriphos 2ml per liter of water
Farmer asked fungus control information,WP
tell me jerra rate jodpur mandi,13250 rsqu
asking about sowing season for groundnut,:         :  -    -
ASKING ABOUT THE WEED MANAGEMENT OF GROUNDNUT,APPLY  QUIZALOFOP-P-ETHYL 5  EC   135 ML   BIGHA
Farmer asked query on Weather,:   -      : :             29  C    24  C     8
Fertilizer for groundnut,Already applied  advise to wait few more days
asking about groundnut leaf caterpillar management,recommended for spray chlorpyriphos - 2 ml lit of water
WHITE GURB IN GROUNDNUT,QUIENALPHOS 25  EC 4   LITTER  HACTER WATER SPRAY
fertdose in gnut,fertdose in gnut - apply urea 25 kg  bensalf 20 kg  acre
CATERPILLAR,SPRAY CHLOROPYRIPHOS 2MLLITRE
FARMER ASKED ABOUT VARIETIES OF GROUNDNUT,- -  -      -    -  -  -     -         -  -
asking about cut worm control in groundnut,Recommended for Spray chlorpyriphos 2 ml litre of water
groundnut fertilizer,apply DAP 30 kg potash 35 kg  ac in basal
varieties of papaya,varieties of papaya -taivan 786pusa delicious soloco-2co-7
Damaging symptomsControl measuresAphidsDue to sucking the sap curling of leaves and development of sooty mold,Spray Dimethoate 30 EC  17 mllit water
Ask about nutrient management,all information provided - thanks for calling in kisan call centre
Groundnut leaf miner,recommended for the spray Dimethiate  2mllit of water
Information about to weed control of ground nut,--
larval infection,RECOMMENDED TO SPRAY NOVALURAN REMAN NOVA SICISSORS  400 ML PER ACRE
gram pod borer in groundnut,recommended for spray imidachlopride 5ml10 lit of water
ask for white grub control information,suggest:chloropyriphose 25 mlpump
FARMER ASKED ABOUT TO SEED REEATMENT IN GROUNDNUT,20  4   2
Farmer asked weed control in crop,- 5 EC   -
