QueryText,KccAns
Asking about aphid  in groundnut,Recommended for spray Chlorpyrifos  2ml  liter of water
Asked about Leaf caterpillar and aphids management in Groundnut,:      :  2
Leaf eating caterpillar in Groundnut,recommended for spray Profenophos 2 ml liter
WANT TO KNOW ABOUT HOW TO CONTROL WEEDS IN GROUNDNUT FIELDS,Clodinafop Propargyl 15 WP            I  -         I
asking about weather in jhansi,no chance rain
groundnut season,Anippattam June-July
TELL ME INSECT CONTROL IN GROUNDNUT,SPRAY OF PROFENOFOS 15 ML PER LITER WATER
Ground nut wilt control,Recommended for spot drenching carbendazim 2 g bavistin   lit of water
Farmer asked query about plant protection,5
Farmer asked query on Weather,:       :             37     24      8
Farmer asked query on Weather,CLOUDY WEATHER IN YOUR AREA AND   NO CHANCE OF RAIN
caterpillar damage in ground nut,RECOMMENDED TO SPRAY EMAMECTIN BENZOATE  90 GRAMS 200 LITRES OF WATER  ACRE
Farmer asked query on Weather,36     32           5
QUERY: groundnut early leaf spot,ANS: spray mancozeb 2 gm  lit
farmer ask about fertilizer uses,90  15
Plant protection,Spray chloropyriphos  25 ml  1 liter of water
farmer want to know information about how to control caterpillar in groundnut,5 SG 8-10
Asked about Groundnut sowing season and varieties suitable for sowing through the year,:            :
ASKED SEED TREATMENT FOR GROUNDNUT,USE 5 GM OF TRICHODERMA  KG OF SEEDS
groundnut top dressing fertilizer application,recommended for apply gypsum 75 kilo  borax 2 kilo  acre
asked about information groundnut,asked about information groundnut -Spray fame 5ml15 Lit of Water
Farmer asked fungus control information of in groundnut,WP
TELL ME ABOUT CONTROL OF COLLER ROT IN GROUNDNUT,SPRAY  OF PROPICONAZOLE 1 ML PER LITER WATER
TELL ME CONTROL OF INSECT IN GROUNDNUT,SPRAY OF INDOXACARB 145 SC 1 ML PER LITER WATER
ATTACK OF THRIPS ON GROUND NUT,Spray Confidor 6ml15 Lit of Water
TELL ME WEED CONTROL IN MOONG,NO USE HERBICIDAY  IN STANDING CROP IN MOONG
TELL ME POWDERY MELDEW IN MUSTARD,SPRAY OF CALECSIN 1 ML LITER WATER
TELL ME CONTROL OF WEED CONTROL IN GROUNDNUT,SPRAY OF PENDIMETHILIN 30 EC 25 LITER PER HA AFTER SOWING BUT BEFORE GERMINATION
ASKED ABOUT ATTACK OF SUCKING PEST AND CATERPILLAR,SPRAY ACTRA 7 GM  RIDOMIL GOLD 30 GM  IN 15 LIRE OF WATER
groundnut,monocrotophos 2ml  neem oil 5mll
TELL ME DISEASE COTROL IN GROUNDNUT,DRENCHING OF CARBENDAZIM 250 GMBIGHA IN ROOT ZONE WITH IRRIGATION
tell me control of root rot in groundnut,1
TELL ME WHITE GRUB CONTROL IN GROUNDNUT,SPRAY OF QUINALPHOS 4 LIT PER HECTER WITH IRRIGATION
ask abt ground nut in white groub,Chlorpyriphos 30 ml  15 lit water
Asking about groundnut leaf eating caterpillar,recommended for the spray  profenophose  2 ml lit of water
weedicide in groundnut crop,use basalin or pendimethilin in groundnut crop
Asked about nutrient management,Zinc sulphate- 4 kgacreBorax- 4 kgacreGypsum- 200 kgacre
Farmer asked query on Weather,:           :       -                   38C    26C      8
seed rate of groundnut,recommended for Use 125 kgha of kernels
Asking about pest management in groundnut,:     :   1   2
variety,smrutikissan ak 1224
TELL ME INSECT CONTROLE IN GROUNDNUT,SPRAY OF TRIZOPHOS 40 EC 2 ML PER LITER WATER
Farmer asked query on Weather,3            18      9      7
BASAL DOSE OF FERTILISER IN GROUNDNUT,RECOMMENDED TO APPLY 4 KG UREA35 KG DAP AND 26 KG POTASH PER ACRE AS BASAL DOSE OF FERTILISER IN GROUNDNUT
fertilizer application in groundnut,recommended to apply 9 kg urea 16 kg phosphorus 16 kg potassium to be applied
Nutrient management in groundnut crops,Advise to apply 5kg urea35kg dap26kg mop
Farmer asked weed control in groundnut  crop,-                      ww ME  -
Ground nut gram pod borer management,RECOMMENDED TO SPRAY EMAMECTIN BENZOATE  90 GRAMS 200 LITRES OF WATER  ACRE
leaf miner control in Groundnut,recommended for spray dimethoate 15 mlteepol 05 mllit of water
FARMER ASKED ABOUT TO NUTRIENT MANAGEMENT IN GROUNDNUT,8-10
plant protection,spray mncozeb 2gl
Asking about Basal fertilizer management for groundnut,:    : :  80    50     8
Information about of Growth plant required in Pea nut  crop,8-10kg acor
TELL ME NUTRIENT MANAGEMENT,----  33 5   10
nematodes in groundnut,-Apply carbofuran 3 -5 kglt of
caterpiler,spray for fame
How much urea should be used after irrigation in groundnut crop,20
farmer want to seed treatment  of ground nut crop,Use bavastim 3 gm per kg of seed
Farmer asked query on Weather,CLOUDY WEATHER NO CHANCE OF RAIN
ask for trips control information,suggest:thayomithoczem 5 mlpump sprey
THRIPS ATTACK ON GROUND NUT,Spray Roger 15 ml15 Liter of WaterDimethoate-Cheminova
GROUND NUT GYPSUM DOSAGE,200 KG GYPSUM AT FLOWERING STAGE : GROUND NUT
ROOT ROT CONTROLE IN GROUNDNUT,DRENCHING OF CARBENDAZIM 1 KG  PER HA IN ROOT ZONE
Farmer asked query on Weather,:              :           -                     - 37C   -  26C       8
tell me groundnut  RATE OF JODPUR MANDI,3400 RU QU
Farmer asked fungus control information of groundnut,wp
Farmer asked fungus in root control information In groundnut crop,WP
ASKING ABOUT WEATHER INFORMATION,CLOUDY WEATHER TILL 22 JUNE BUT NO CHANCES OF RAIN
Groundnut rust,Recommended for spray chlorothalonil 2 g litre
Asked about Water management in Groundnut,:       :
Asking about tobacco caterpillar in ground nut,:     :  2
For better grain filling in Groundnut,Recommended to spray Fantac Plus 1ml in 2litres of water for better grain filling in Groundnut
groundnut red leaf spot control,spray contaf 15 mlpump
Farmer asked Varieties information of Castor  crop,-   -              -
Farmer needs information regarding procedure to seed treatment in groundnut,:            25      -        70   3
Asked about leaf curl virus disease management in groundnut,:      : :      2
TELL ME ABOUT THE CONTROL OF INSECT IN GROUNDNUT,15
Asking about prevention disease management for ground nut,:        :     1   25
peanut stem necrosis disease,CHLORPYRPHOSKORBAN DURSBAN LETHAL CLASSIC RADAR 500 ML PER ACRE
Farmer asked Sucking pests and Larvae problem in crop,25- 40                EC
groundnut season,apr-may
Asking about top fertilizer management,Recommended for apply gypsum 100 kg and borax 4kg
attack of sucking pest on groundnut,spray actra 5gm15lit water
Rootrot in groundnut,Drench with 2gram Saaf  1gram plantomycin per 1ltr water
TELL ME  INSECT CONTROL IN GROUNDNUT,SPRAY OF TRIZOPHOS 40 EC 2 ML PER LITER WATER
Ask about Plant Growth Retardant Information groundnut,-         SL
information about seed treatment in groundnut,3     3     2
Farmer asked about fungus problem in groundnut,EC -
TELL ME INSECT CONTROL IN,USE IMIDACHLOPRID 178 SL 1 LITER PER HA WITH IRRIGATION FOR CONTROL OF TERMITE
Information regarding the control of root blackening in groundnut crop,Carbofuran 3G  8  10
ask about white grub in groundnut,i suggest cloropiriphos 4 liter per ha
basal fertilizer management for,basal fertilizer management for groundnut  apply 50KG DAPAC
GROUN NUT THRIPS MANAGEMENT,RECOMMENDED TO SPRAY IMIDACLOPRID 60 ML 200 LITRES OF WATER  ACRE
Farmer asked fungus control information of,SE  10
early leaf spot,Carbendazim 500 gha
asking about groundnut leaf minor,recommended for spray dimthoate 2 ml 1 litre of water
FARMER ASKED QUERY ON SEED TREATMENT IN GROUND NUT,RECOMMENDED TO SEED TREATMENT CAPTAN    OR THIRAM OR MANCOZEB 3 GRAMS  KG OF SEEDS        3          1     10
ask about sucking pest in gnut,I suggested imidakloprid 10 ml  10 lit water
FARMER ASKED QUERY ON IRRIGATION  MANAGEMENT IN  GROUND NUT,RECOMMENDED TO GIVE IRRIGATION AT FLOWERING  STAGE
TELL ME SOWING TIME OF GROUNDNUT,SOWING TIME OF GROUNDNUT JUNE LAST TO JULY 15
FERTILIZER MANAGEMENT IN GROUNDNUT,ZYPSUM 200KGACRE IN GROUNDNUT
catterpillar,Drenching of Chloropyriphos 40 ml  15 lit of water
BALANCE DOSE OF FERTILIZER APPLICATION IN GROUNDNUT,RECOMMENDED TO APPLY 10 KG DAP5 KG MOP8 KG UREA PER ACRE AS BALANCE DOSE OF FERTILIZER APPLICATION IN GROUNDNUT
vaieties of groundnut,vaieties of groundnut- TAG-24 SB-11
TELL ME WEATHER REPORT IN BANSWARA,NO RAIN POSSIBILITY IN NEXT 3-4 DAYS BUT CLOUDY SKY
dose of zipsum in groundnut,250kghacter apply zipsum in groundnut
gnut fertilizer,25kg nitro and 50kg phos
aphids in groundnut,recommended for spray dimethoate 2mlneemoil 3mlteepol 1mllit of water
Asking about weather forecast,cloudy weather  rainfall chances today
Asked about recommendation of 3G extract with neem oil,:            :
GNut Plant Protect,Hirakashi 100gm  Citric Acid 10gmPump
weed management of ground nut,pendimethelin 30 ec  1 liter acre
ASKED ABOUT TO DISEASE CONTROL IN  GROUNDNUT,2
Farmer asked about larvae problem in groundnut,SCSG
Farmer asked query on Weather,:   -     : :            31  C    26  C     9
Farmer needs information regarding control of weeds in garlicrice crop,Recommended for before germination use pendimethilin 1 liter at  per acre or 50 ml per pump
Fertilizer Dose -,GOAL
Asked about Leaf roller management in groundnut,recommended for spray dimethoate 2mlneem oil 3mlteepol 1mllit of water
TELL ME FIRST IRRIGATION TIME OF GROUNDNUT,AFTER SOWING 3-4 WEEK
FRUIT ROT,TRICOGAMA VIRIDI 15KGACRE
ground nut top fertilizer management,recommended fro apply gypsum 75 kilo  acre
mites,dicofol 2mlltr
GROUND NUT LEAF EATING CATERPILLAR,RECOMMENDED TO SPRAY CHLORIPYRIPHOS 500 MLAcre
ASKED ABOUT FERTILIZER DOSE FOR GROUNDNUT,-   1
YELLOW LEAF IN GNUT,FERROS SULPHATE 25 GRAM IN 15 LIT WATER
PEST IN GROUNDNUT,DIMETHIOATE 15 ML  1 LITER
SEED TREATMENT OF GROUND NUT SEEDS,RECOMMENDED TO TREAT SEEDS WITH CARBENDAZIM 2 GM PER KG SEED
groundnut basal fertilizer management,Recommended for apply DAP 41 kg potash 24 kg ac
GROUNDNUT ROTTENING,CALL CANNOT BE COMPLETED PLEASE CALL AGAIN
rain water damage,zineb 2gl
Information about pest management in Groundnut crop,Fipronil 06 GR 4
Asked about Nutrient management in GROUNDNUT,--Recommended to spray SAMRUDDHIMULTIPLEX tonic  2mllitre of water
Ask about seed treatments of White Grub in Groundnut,WDG -
NUTRIENT MANAGEMENT IN GROUNDNUT AT PEGGING STAGE,APPLICATION OF GYPSUM 200 KG ACRE AT PEGGING STAGE IN GROUNDNUT
FARMER ASKED ABOUT FERTILIZER SPRAY ON GROUNDNUT,- : :  -60
Farmer  wants to know information about How to control of rodents attack in pea nut crop,Recommended for to control of rodents attack in pea nut crop apply zinc phosphide in field
COLLAR ROT MANAGEMENT IN GROUNDNUT,RECOMMENDED TO SPRAY MANCOZEB 3 GRAMS PER LITRE WATER
TELL ME CONTROL BREAT NACROCIS IN GROUNDNUT,SPRAY OF DIMETHOATE  30 EC 2 ML PER LITER WATER
IMPROVE PODDING IN    GROUND NUT,APPLY  GYPSUM  100 KGS  ACRE
Season of sowing for groundnut,recommended Season of sowing for groundnut April -may
ASK FOR GNUT TERMITE,suggest:Chlorpyriphos 30 ml  10 lit water
Farmer wants to know information about can use of weedicide in flowering condition ground nut crop,I
Attack of Thrips,Spray Actra 5 gm15 Liter of Water Thiomithoxom 25-Syngenta
Farmer asked Larvae control information of of groundnut crop,SC 7-8
TELL ME NUTRIENT MANAGEMENT IN GROUNDNUT,SPRAY OF FERROUS SULPHATE 5 GM  CITRIC ACID 1 GM PER LITER WATER
TELL ME ABOUT WEATHER INFORMATION,RAIN POSSIBILITY IN NEXT 5 DAYS IN YOUR DISTRICT
WEATHER--BADAUN,IS SAPTAH BADAUN ME BARISH KI KAM SAMBHAVNA HAIN
Asking about groundnut seed treatment,:      :  10
GROUND NUT HELICOVERPA,CORAZEN 60MLACRE IN 200 LITER WATER
TELL ME ABOUT INSECT CONTROL IN  GROUNDUT,25   4
TELL ME VARIETIES IN GROUNDNUT,TG-37GG-20G-2CHANDRA
asking about groundnut growth regulator use,recommended for groundnut rich 2 kg 200 litre of water
top dressing for groundnut,recommended for apply Gypsum 150gmborax 10kgac
FARMER ASKED QUERY ABOUT WEED MANAGEMENT IN GROUNDNUT,RECMMENDED TO SPRAY IMAZITAPYR IMAZAMAX - 40 GR 200 LITRES OF WATER PER ACRE
ROOT ROT IN GROUND NUT,BLITOX 3 GRLT WATER
asking about sesamum top dressing fertilizers,Recommended for apply urea 12kg  ac
TELL ME ABOUT PEST IN GROUNDNUT,USE OF IMIDACLOPRID  250 ML BEEGHA IN GROUNDNUT
TELL ME GROWTH IN GROUNDNUT,UREA-10KG  ZINK SULFET 5 KGBIGHA
GROUND NUT FERTILIZER MANAGEMENT,GROUND NUT FERTILIZER MANAGEMENT30 DAYS AFTER SOWING APPLY 9 KG UREA
Ground nut Red spider control,Recommended for spray propargite 2 ml  lit of water
MUNG PHALLI ME white grub sundi lag rhi hai,apply- fipronil 3g -10kgacre prayog kre
ASKED ABOUT TO CONTROL OF FLOWER DROPING,45   1    4
ask for groundut chlorosis,suggest:hirakashi powder 150 gmleman flower 15gmpump sprey
asking for the pest management in groundnut,recommended for the spray of neem oil 3 ml  teepol sticking agent 1 ml in 1 litre of water to control pests
VARIETIES,Phule Pragati  kopergaon -1
GRAM CATERPILLAR MANAGEMENT,GRAM CATERPILLAR MANAGEMENT :  RECOMMENDED TO SPRAY FLUBENDIAMIDE  40 ML 200 LITRES OF WATER  ACRE
peanut stem necrosis,RECOMMENDED TO SPRAY DIMETHOATEROGAR   ROGARIN  400MLACRE
ASKING ABOUT THE VARIETIES OF GROUNDNUT,- -
root rot in groundnut,root rot in groundnut :                                                                                                                                                                                                                                                                                          RECOMMENDED TO SPRAY COPPER OXY CHLORIDE BLITOX 600 GRAMS PER ACRE
TELL ME ROOT ROT CONTORL IN GROUNDNUT,DRENCHING OF CARBENDAZIM 250 GMBIGHA IN ROOT ZONE WITH IRRIGATION
Bihar hairy caterpillar,recommended for spray with Ekalax 2 ml in 1 litre of water
ask for gnut yellowing,suggested ferrous sulphate 100 gram  10 lit
CONTROL OF RUST DISEASE IN GROUNDNUT,RECOMMENDED FOR SPRAY  CHLOROTHALONIL 75 WP   2 GM   LIT OF WATER
Asking about root rot in Ground nut,Recommended for drench with Carbendasim 25 gram litre of water
SEED TREATMENT IN GROUNDNUT,SEED TREATMENT IN GROUNDNUT : RECOMMENDED  MANCOZEB  3 GRAMSKG SEEDORCARBENDAZIM 1 GRAMKG SEDD
Asking about controlling of weeds in groundnuts,Apply pendimethaline
ask for gnut rust  larva managment information,suggest: chlorothelonil 30 gmpamp cypermethrin 15 mlpump sprey
Season for groundnut,recommended for sowing at april-may
Asking about termite management in groundnut,1
TELL ME WEATHER INFORMATION OF TONK,NO RAINFALL NEXT FIVE DAYS OF TONK
leaf blight,copper oxy chloride 3g in 1lt of water
WHITE GRUB IN GROUNDNUT,USE QUNALPHOS 1LBIGHA
Asked about biological pest and disease management in Groundnut,:     :              NPV
FARMER ASKED ABOUT IRON DEFICIENCY MANAGEMENT IN GROUNDNUT,SUGGETSED TO SPRAY FESO4 1KG AND NEEM SALT 200G PER ACRE
TIKKA DISEASE,MANCOZEB 3GMLIT
TELL ME FUNGUS CONTROL IN GROUNDNUT,APPLY HEXACONAZOLE 5 EC 300 ML PAR BIGHA WITH IRRIGATION
ASKED ABOUT TO NUTRIENT MANAGEMENT GROUDNUT,5     1
asking about the control of stem  rot in groundnut,SPRAY  THIOPHANATE METHYL 70 WP  1 GM    LIT OF WATER
Farmer needs information regarding how to control  caterpillar  in groundnut crop,03 GR     8  10
basal fertilizer management for ground nut,apply 50kg super phosphate ac
mung phali ki patti me sundi lagi hai,Quinalphos 25EC 1mlliter ka sprey kare
termit control of groundnut,USE CHLOROPYRIFOS 20 EC 4 LITER PER HA WITH IRRIGATION
leaf miner in groundnut,Recommended for spray Dimethoate 2ml  litre of water
groundnut leaf eating cater pillar management,RECOMMENDED TO SPRAY EMAMECTIN BENZOATE  90 GRAMS 200 LITRES OF WATER  ACRE
Farmer asked query on Weather,:   -      : :             31  C    23  C     6
Asking about root rot prevention management  in groundnut,:       :   1     20
asking about fertiliser in groundnut,Suggest to not require nitrogenous fertilizer
asked about biofertilizer management in groundnut,:      :    1  20      1
farmer asked about attack of wilt in groundnut,30
WHITE GRABS IN GROUNDNUT,KARBANDAZIM 300 GRAM PER BHIGA
LAST IRRIGATION IN GNUT,AT MATURITY STAGE
tell me weather information,LIGHT RAIN MAY BE IN NEXT 2 DAYS
asked about to   DISEASE CONTROL IN   groundnut,50   250
The farmer asked seed treatment of white grub control,30  FS
TELL ME MANDI RATE OF GROUNDNUT,JAIPUR GRAIN  GROUNDNUT WHITE 4100
TELL ME CONTROL YELLOWING IN GROUNDNUT,SPRAY OF ZINK SALFET 4 GRAM PER LITER WATER
asked about weed management in groundnut,:        :
leaf folder in ground nut,chloripyriphos  25mllit water
Farmer asked Fall Armyworm problem in ground nut crop,SC
Asking about micro nutrient deficiency in groundnut,:      :      5
fungi problem in gnut,suggest:hexakonazol 30 gm per pump and to sprey
ASKED ABOUT ZYPSUM DOSAGE,SUGGEST  TO APPLY 200KG PER ACRE
Ask about fungus problem in ground nut crop,-
how to control colar root diseases ground nut,spray carbendazimmencozeb35gtricodrma viride 75gpump
powdery meldew on grnut,Sprey Topaz 10 ml 15lit of Water
ASKED ABOUT FUNGAL ATTACK ON pea nut,15
Asked about Plant protection in  groundnut,Recommended to spray Imidachloprid 178 SL- 05 ml per lit water
Asking about leaf caterpillar and leaf blight in groundnut,:         :     2    2
groundnut varietis,groundnut varietis -TAG 24 JL 24
FARMER ASKED ABOUT THE CONTROL THE LEAF EATING CATERPILLER,ppm-         30
MANCOZEB  2GLT,MANCOZEB  2GLT
TELL ME DISEASE CONTROL IN GROUNDNUT,25  100
asked groundnut,multi k 1 kg  acre
Groundnut Fertilizer dose,--                                                   -                    -
post emergence weed management for groundnut,Spray Imazethapyr  3 mllitre at 20-30 days
ASKING ABOUT THE CONTROL OF ROOT ROT IN GROUNDNUT,SPRAY   THIOPHANATE METHYL 70 WP  1 GM    LIT OF WATER
Farmer asked fungus control information of groundnut crop,70  WP 30
asking about leaf miner in groundnut,Recommended for spray Dimethoate 2 ml  lit of water
groundnut variety information,gg-20 2 june-july
NEMATODES MANAGEMENT IN GROUND NUT,RECOMMENDED TO APPLY CARBOSULPHAN GRANULES 5 KGSACRE
Farmer asked about weed control in Groundnut crop,165   -  8
Farmer asked fungus control information of groundnut,4    68  40
Ground nut in aphids,Recommended for Ground nut in aphids spray dimethoate 2 ml teepol 1mlliter of water
TELL ME BLACK ROT CONTRPOL IN GROUNDNUT,DRENCHING OF CARBENDAZIM 1 KG PER HA WITH IRRIGATION
LEAF WEBBER IN GROUNDNUT,RECOMMENDED SPRAY QUINALPHOSKINALUX 2MLLTR WATER FOR LEAF WEBBER IN GROUNDNUT
weed in mugfali  me,hand weeding krwade aap
red hairy caterpillar in groundnut,Spray quinalphos 25 EC 2ml  lit of water
block spots on ground nuts pods,recommended ETHOPHAN PRACOX 200MKLACRE
INFORMATION REGARDING IMPROVED VARIETIES OF GROUNDNUT,IMPROVED VARIETIES OF GROUNDNUT : MH-4  PUNJAB MUNGFLI-1
Farmer wants to know information about how to control sucking pest in groundnut crop,Recommended for to control sucking pest Spray Dimethoate 30 EC 500 mlha
Ask about blank pod inground nut,-
groundnut me sudi lagi hai jankari lani hai,Monocrotophos 36 SL 2 mili  liter paani ke sath sprey kre
root rot in groundnut,recommended for drench trichoderma 3 mllt
groundnut variety,groundnut variety - sb 11
Farmer asked seed treatment of fungus problem in  Groundnut,DS -
ground nut sucking pest,RECOMMENDED TO SPRAY TRIAZOPHOS 300 ML PER ACRE
seed growth in ground nut,zypsum apply in fied
disease,saaf 2g
seed rate of groundnut crop,seed rate of groundnut 100 kg seed hecter area
Asked about sowing season in groundnut,suggested that the suitable season for groundnut sowing is august and september
VARIETIES OF GROUND NUT,VARIETIES OF GROUND NUT -AK-12-24DEVI
Asking about Termites management in groundnut,Recommended for soil application chlorpyriphos dust 2 kgac
moog fali ki jankar,moog falo ki prajati -kosal chatra
FARMER ASKED ABOUT VARIETIES OF GROUNDNUT CROP,-
ask about biofertilizer in groundnut crop,:           :
Fungicides,Spray Ridomil Gold 30gm15 LITER WATERMetalaxl-M-Syngenta
top dressing fertilizer mnt in groundnut,apply gypsum 120kgac
ASKED ABOUT TO INSECT CONTROL IN,178  05
borer,rogar
WEATHER INFORMATION OF GANGANAGER,THREE DAYS RAINFALL
Moongfali ki fasal kitne din me taiyar ho jati hai,-   86
Farmer asked query on Weather,35
TELL ME ABOUT NUTRIENT MANAGEMENT,DRENCHING OF CARBENDAZIM 1 KG PER HA IN ROOT ZONE WITH IRRIGATION
Farmer asked white grub control information in Groundnut crop,1   5  GR 25
farmer want to know about seed treetment og groundnut,Recommended for Use bavastim or vita vex power 2-250 gm per kg of seed
root rotin groundnut,copper oxy chloride 3glit-mokka modalu daggara poyandi
Asking about top fertilizer management for groundnut,:     :  6    12    25
ASKING ABOUT FERTILIZER DOSE FOR GROUNDNUT,- -     1     80      8
ask abt groundnut in tikkka,hexaconazol 15mlpump to apply
fungus in gnut,CARBENDAZIN 250 GRAMBIGHA
ROOT PROBLEM IN GROUNDNUT,DRENCHING OF CARBENDAZIM 1 KG  PER HA IN ROOT ZONE
mungphali upchar ke liye,carbendazim 2 gram or thiram 25 gram dawa  kg seed ke hisab se upcharit kare
GROUNDNUT LEAF EATING CATERPILLAR MANAGEMENT,RECOMMENDED TO SPRAY CHLORIPYRIPHOS 500 MLAcre
TELL ME WEATHER REPORT BARMER,RAIN FALL POSSIBILITY NEXT 5 DAY BUT CLOUDY
Asking about Sucking pest control management in Groundnut,:      :
Asking about Groundnut 1812 seeds availability,:  1812
ASK FOR THE YELLOWISH OF GROUNDNUT LEAF,SPRAY OF 20GM FESO4  10ML CITRIC ACIDPUMP
weed control in groundnut,30-35
call from Bihar,suggested
Blight Attack,Spray Bavistine 30gm15lit of Water
groundnut amendments,gypsum 200kgacre
TELL ME DISEASE  CONTROL IN,USE HEXACONAZOLE 5 EC 1 LITER PER HA WITH IRRIGATION
TELL ME SEED RATE OF GROUNDNUT,SEED RATE 20-25KGBIGHA
SUCKING PEST IN GROUNDNUT,spinosad 75ML ACRE
VARITIES OF GNUT,VARITIES - TAG- 24  SB - 11
asking about Leaf eating caterpillar control in groundnut,recommended for Spray neem oil 3 mllit of water
Suppliment nutrient for ground nut,Spray multi K 75 gram in 1 litre water
stem rot disease control in groundnut,Dear farmer use to  Copper Oxychloride 50 WP  25gliter water splash in the field
ask for termite control information,25
Farmer asked query on Weather,:   -      : :              34  C    25  C     9
groundnut spacing,spacing of 15cm x 15 cm
TELL ME CONTROL SUCKING PEST IN GROUNDNT,SPRAY DAIMETHOIT 30EC 2MLLITTER WATER
groundnut,recommended to spray dimethoate 2 milli liter  liter water
Farmer asked weed control in Groundnut crop,30 EC      -       -  -
TELL ME WEATHER INFORMATION OF NAGOUR,FOUR DAYS RAINFALL
Farmer asked fungus in root control information of,4    WP -
ask abt groundnut in variety,Gujarat groundnut-20
Farmer asked query on Weather,:   -     : :             30  C    20 C     6
Ground nut tobacco caterpillar,Recommended for spray chlorpyriphos 2 ml teepol 1 mlliter of water
Farmer asked query on Weather,:   -       : :               31  C    22  C     6
Red hairy caterpillar problem in groundnut crop,Recommended to spray cholropyriphos 500 mlacre
Farmer asked query on Weather,-                                  27      24      5          I
FARMER ASKED ABOUT ATTACK OF APHIDS ON GROUNDNUT,-  -           126    95
saff  2gm  1ltr,saff  2gm  1ltr
sucking pests in groundnut,RECOMMENDED TO SPRAY THIOMETHOXOME ACTRA SITARARENOVA 40 GRAMS PER ACRE
TEL ME WEATHER REPORT IN SIKAR,NO RAIN POSSIBILITY IN NEXT 5 DAYS IN YOUR DISTIC
ROOT ROT IN GROUNDNUT,ROOT ROT IN GROUNDNUT-SPRAY COPPER OXY CHLORIDE 3GM IN 1LITRE OF WATER
TELL ME ROOT ROT DIEASE CONTROL IN GROUNUT,DRENCHING OF CARBENDAZIM 2 GM PER LITER
ASKED ABOUT GROUNDNUT PLANTATION,-  -             -      -           SSP
Farmer asked about weedicide on groundnut,-
basal stem rot in groundnut,soil application trichoderma viridi 2kgac mixed with FYM or sand
Groundnut nut plant protection,Regent-2mllit
Asked about red spider mite management in groundnut,:    : :      2
TELL ME ABOUT WEATHER INFORMATION OF BIKANER DISTRICT,NO RAIN POSSIBILITY IN NEXT 3-4 DAYS BUT CLOUDY SKY
GROUND NUT BORON DEFFICIENCY,RECOMMENDED SPRAY BORAN 15GLITRE OF WATER
TELL MEblack  ROOT ROT CONTROL IN GROUNDNUT,250
Asking about Market name of Boron fertilizer,:     : Solubor
TELL ME ABOUT WEATHER INFORMATION,some clouds and chance to rain fall today
TERMITE CONTROL IN GROUNDNUT,USE IMIDACHLOPRID 178 SL 1 LITER PER HA WITH IRRIGATION
Tikka leaf spot problem in groundnut crop,recommended to spray Mancozeb 500 gracre
TELL ME  ABOUT LOW GROWTH IN GROUND NUT,SPRAY OF MULTIPLAX MICRONUTRIENT 4 ML PER LITER WATER
yellowing leaf control,spray feso4 100gmpump
TELL ME CONTROL OF FRUIT BORER,SPRAY OF ACEPHATE 75 SP 2 GM PER LITER WATER
weedicide,pershuet
Farmer asked fungus in root control information of Groundnut crop,WP 35-
Termite control in groundnut,Advised to apply Chloropyriphos  15DP  10kgacre for control of termite in groundnut field
ask information about  control of heliothis,I suggested to spray endozacarb 7 mili pump
Attack of White Grub IN GROUNDNUT,Attack of White Grub IN GROUNDNUT -Humnasur 6 kgacrePatil Biotech
Asked about top fertilizer management for groundnut,:    : :     50
TELL ME ABOUT SEED TREATMENT OF GROUNDNUT,30FS 75ML
WEATHER INFORMATION,TODAYS WEATHER PARTLY CLOUDY NO CHANCES OF RAINFALL
ground nut sucking,recommended DIMETHOATEROGAR   ROGARIN  400MLACRE
Asking about Ground nut leaf webber and whitflys management,:     2    50
TELL ME COLAR ROT DISEASE CONTROL IN GROUNDNUT,TRICODERMA 25 KG HECTAR IN FYM 100 KG
Asking about groundnut seed farming information,:    :
TELL ME MANDI RATE IN GUAR NAGAUR,MANDI RATE IN GUAR NAGAUR  RS 3600 RUPAY PER UQ
FARMER ASKED ABOUT VARIETIES FOR SUMME GROUNDNUT,-  -  -
Asked about disease prevention management in groundnut,:    :      5
asking about groundnut caterpillar management,recommended for spray  indoxacarb 1 mllitre of water
groundnut affected by colar rot,give bavistin 250gm  bigha with irrigation water
Farmer asked termitewhite grub control information of groundnut,40
fertilizer for groundnut,give gypsum 50 kg acer after 40 days of sowing
Herbicide,Use Pesuit
ASK ABOUT GENERAL INFORMATIO,Nall information provided - thanks for calling in kisan call centre
FARMER ASKED QUERY ABOUT GROUNDNUT CROP,-
ASKED ABOUT TO INSECT CONTROL IN GROUNDNUT,5     1
stem rot management  in ground crop,RECOMMENDED TO DRENCH COPPER OXY CHLORIDE  Blitox 3 GRAMS  1 LITRE OF WATER    3
