QueryText,KccAns
TELL ME CONTROL OF BLACK ROOT IN GROUNDNUT CROP,DRENCHING OF CARBENDAZIM 1 KG PER HA WITH IRRIGATION
TELL ME CONTROL BLACK ROOT ON GROUNDNUT CROP,USE-BAVISTIN 250GM PER BIGHA WITH IRRIGATION
Farmer asked Army worm Problem in Ground Nut crop,SC 7-8
TELL ME WEATHER INFORMATION,NO RAIN POSSIBILITY IN NEXT 5 DAYS IN YOUR DISTRICT  SOME CLOUDY SKY
FARMER ASKED ABOUT WATER MANAGEMENT OF GROUND NUT,-   -                -
FARMER ASKED ABOUT CATERPILLAR ATTACK ON GROUNDNUT,SG-
ASKED   ABOUT FERTILIZER DOSE FOR GROUNDNUT,- -
FARMER ASKED QUERY ABOUT ON STEM ROT MANAGEMENT IN GROUNDNUT,RECOMMENDED TO SPRAY MANCOZEB 400 GMACRE
SOME VARIETY OF GROUNDNUT FOR RABI SEASON,RECOMMENDED FOR APPLY SOMNATH GIRNAR-1JL-24MH-2 ETC
Farmer asked query on Weather,:             :         -                   - 28C   -  23C       8
--ASKED ABOUT TO DISEASE CONTROL IN  GROUNDNUT,75   45   2
WILT ATTACK ON GROUND NUT,30     30
Asked about plant protection in groundnut,Suggested to Spray mancozeb 2gl
asked about rootrottening,spray coc
ground nut leaf curl,spray acetamoride 025mlliter
ground nut seed treatment,ground nut seed treatment :  imidachloprid 2ml  and tricoderma viride 3gm  kg of seed
Asking about diseases affecting groundnut crop,:      :
Asking about Root grub in ground nut,Recommended for apply Carbofuron 4 kg neem cake 25 kgac
TERMITE AND ANT CONTROL,YOU CAN USE PHORET 3-4 KG ACRE AREA USE FOR TERMITE AND CONTROL
ASKING ABOUT GROUNDNUT NECK ROT MANAGEMENT,GROUNDNUT NECK ROT MANAGEMENT  DRENCHING OF CARBENDIZIUM 1GMLK OF WATER
wilt,spray actara 5 gmpump
TELL ME ABOUT INSECT CONTROL IN GROUNDNUT,50   2
varities of ground nut,kadiri-4568 narayanigrishma are best varities of ground nut
FARMER ASKED ABOUT WEED MANAGEMENT IN GROUNDNUT,-  -       -       -
Asking about Water management During Spraying,:       :
FARMER ASKING ABOUT ATTACK OF SUCKING PESTS ON GNUT,:
Asked about ground nut top dressing fertilizer management,:      :   75     45
asking about groundnut top dressing fertilizer management,Recommended for apply gypsum 75kg  Borax 4 kg  acre
rust management in groundnut,rust management in groundnut : RECOMMENDED TO SPRAY CHLOROTHALONIL 400 GRAMS  ACRE
ASKED ABOUT INFORMATION GROUNDNUT,1846 1 BAG ACRE FERTILIZER VAPRAVE
FERTILIZER,GYPSUM 100 KGACRE
Farmer want to know information about variety of groundnut,phoolo prgatigg-3jgn
mosam ke bare me jankari de,aapke block me halke baadal rah sakte hai barish hone ki sambhavna nhi hai
ASKED ABOUT SUCKING PEST ATTACK ON GROUNDNUT,-   -
GROUND NUTRIENT MANAGEMENT,RECOMMENDED TO APPLY 200 KG GYPSUMACRE
Asking about  groundnut pre harvest sprouting information,:         :
ASKING ABOUT PREVENTIVE MEASURES OF COLLAR ROT OF GROUNDNUT,RECOMMENDED FOR SPRAY  COPPER OXYCHLORIDE 50 WP   4 GM  LIT OF WATER
TELL ME ABOUT WEED CONTROL IN GROUNDNUT,2  10
farmer asked query on nutrient management in groundnut,---RECOMMENDED TO SPRAY MULTI NUTRIENT MIXTURE 5 GR1 LITRE OF WATER
Ask about groundnut leaf yellow chlorosis problem,00     0
ask control of fungus,i suggested spray mencozeb 25 gram 10 li Water
Farmer asked Larvae control information of  groundnut,magfli         EC 30
Asking about intercropping of tapioca with groundnut information,:       :
TELL ME DIMAK CONTROL OF GROUNDNUT,TERMITE CONTROL IN CHILLI USE CHLOROPYRIPHOSE 20 EC  4 LITER HAC WITH IRRIGATION
asking about Groundnut foliar application information,:      : TNAU   2     200
FARMER ASKED FERTILISR DOSE IN GROUNDNUT CROP,--   -  : :
ground white fly,ulala 75gmacre
Asked about root rot and stem rot management in groundnut,:        :  1  1
ground nut ki jade sad rahi hai,Hexaconazole 5 EC 600 ml acre me prayog kare
Thrips Attack,Spray Karate15 ml15 Lit of Water
seed treatment in groundnut,recommended to apply 3 grams mancozeb and 3 grams imidacloprid per kg seed
Farmer asked query on Weather,5                 26
jypreq,100kgacre
want to know about weather report information,possibility of rain and drezzils in the date of  1  3 may  and 4 may
FARMER ASKED ABOUT TO SEED RATE OF GROUNDNUT,80         100
Farmer asked Termite problem in crop,GR
Ask about white fly control information in Ground nut Crop,SP 8
SUCKING PET IN GROUND NUT,RECOMMENDED TO SPRAY ACETAMIPRID   40 GRAMS  200 LITERS OF WATER ACRE
TELL ME   SEED TREATMENT IN GROUNDNUT,USE CHLOROPYRIFOS 20 EC 4 ML PER KG SEED FOR
Tell me sowing time of groundnut,1 jun to 15 jun sowing time
ASK ABOUT GUJARAT RAJYA BIJ NIGAM  CONTACT NUMBER for  groundnut seed purchase,-  -          -  -
Farmer asked query on Weather,SHOWERSRAIN WITH THUNDERSTORM IS LIKELY TO TAKE PLACE IN YOUR AREA
ROOT ROT IN GROUNDNUT,ROOT ROT IN GROUNDNUT-SPRAY SAAF2G PLANKTOMYCIN 1G IN 1LITRE WATER
TELL ME GROWYTH IN GROUNDNUT,SPRAY OF ZINK SULPHATE  5 GRAM UREA 10 GRAM PER LITER WATER
LEAF CATERPILLAR,TRIAZOPHOUS 2ML1LTRS OF WATER
Weather information,Aaj 4 milimeter barish hone ki sambhavna hai
wilt and root grub,drench chloropyriphos  mancozeb 2 gram 2 mili per litre of water
Farmer asked query on Weather,:    -      : :             34  C    24  C     5
FARMER ASKED ABOUT TO FERTILIZER IN GROUNDNUT,2-3 ML
Asked about General Information in groundnut,suggested that to treat the seeds with trichoderma 3 gram per kg of seeds
Asking about growth regulators for Groundnut,:         :      2
ABOUT WEED MANAGEMENT I N GROUND NUT,RECOMMENDED TO SPRAY PENDIMETHALINSTOMP 1-125 LITREACRE
varities  of groundnut crop,you can take for sowing tag 24tg-37 this is groundnut varities
groundnut weediside,hand picking
helicoverpa damage in grountd nut,RECOMMENDED TO SPRAY NOVALURANINDOXICARB PLITHORA 350 ML PER ACRE
TELL ME INSECT AND FUNGAL CONTROL,SPRAY OF ACEPHATE 75 SP 2 GM MENCOZEB 2 GM PER LITER WATER
WEED CONTROL IN GROUNDNUT,USE IMIZATHAPER 100 GRAM PER HECTER
TELL ME BLACK ROOT IN GROUNDNUT,250
Asked about Groundnut foliar application,:       :
ask about larva problem in groundnut,Suggested: DDVP 10 ml  Quinalphos 30 ml pump spray
ROOT ROT IN GROUNDNUT,USE TRACODERMA 1 KGBIGHA
Tobacco cutworm  management for groundnut,recommended for the spray  profenophos  2 mllit  of water
Farmer asked query on Weather,:             :        -                    - 34C   -  24C       8
ASKED ABOUT TO NUTRIENT MANAGEMENT  IN GROUNDNUT CROP,33 5   10
ATTACK OF APHIDS ON GROUNDNUT,:-Thiomithoxom 25-  15
plant protection,pray Dimethoate 30 EC  17 mllit water
weather information,kisan bhai aapke yha es saptah 3 august se 8 august  tak pratidin hlki baaris se lekar bhaari baaris hone ki sambhawana hai
weed management for groundnut,recommended for the spray  Imazethapyr  300 mlacre
Ask about nutrient management groundnut crop,::   -100
Farmer asked query on Weather,5                       28    24
TELL ME ABOUT TERMITE INSECT CONTROL IN GROUNDNUT,178   1
Asking about leaf caterpillar in groundnut,:      :    7   10
Farmer asked seed treatment of fungus problem in Groundnut,DS
Farmer asked thrips Problem in groundnut crop,EC -
Stem rot in groundnut,recommended for the spray Carbendazim 2gmlit of water
sowing time,oct- nov
Asking about top dressing fertilizer management for groundnut,Recommended for apply Urea 5 kg potash 12 kg micro nutrient mixture 5 kgac
ASK FOR SUMMER GROUNDN UT VARIETY INFO,GG-246 FOR SUMMER GROUNDN UT VARIETY
groundnut peanut bud necrosis virus,recommended for spray monochrotophos 2 mllitre of water
Asking about panjakaviya and pesticide mixing,:       :
TELL ME YELLONESS OF GROUNDNUT,NPK 10 GM  LITER WATER SPRAY
TELL ME NUTRIENT MANAGEMENT PEA NUT,SPRAY OF FERUS SULPHATE 5 GM  CITRIC ACID 1 GM PER LITER WATER
mungfali ko jad ko kide kat rahe hai,Cartap Hydrochloride 4 GR8 kiloacre ka prayog kare
RUST IN GROUNDNUT,SPRAY SAAF  2 GM  1 LITER OF WATER FOR CHECKING RUST IN GROUNDNUT
LEAF EATING CATERPILLAR MANAGEMENT IN GROUND NUT,RECOMMENDED TO DRENCH CHLORPYRIFOS 161 LITRE  OF WATER
root rot of pea nut,COPPER OXYCHLORIDE 50 WP 2-3  gram  liter pani ka ghol banaker spray kare
Farmer asked about sucking pest problem in groundnut,WG  - 8
pod borer in groundnut,recommended to apply chloropyriphos 10 kg in one acre
FUNGAL ROT ON GROUNDNUT,DRENCHING OF BLUE COPPER 30 GM 15 litre of water
TELL ME SEED TREATMENT IN GROUNDNUT,CARBENDAZIM 3 GRAMKG SEED
groundnut nutrient mgt,foliar spry with TNAU GROUNDNUT RICH 2kgac
Ask about fungus problem in peanut Root,EC 20
Ask about variety information,all information provided - thanks for calling in kisan call centre
ground nut top fertilizer management,recommended for apply gypsum 75 kg acre
Farmer asked Aphid problem in Ground Nut crop,SP    SP
TELL ME ABOUT WEATHER INFORMATION,23
grouth of groundnut,feras salfete 4gmliter
Asked about Groundnut leaf spot management,:     :      2
Farmer asked query on Weather,:           :           -                - 36C   - 27C     8
Farmer asked seed treatment of fungus problem in,--         WS -
Aphids in Groundnut,Aphids in Groundnut-Spray Thiomethoxam-5gm15 lit of water
FARMER ASKED ABOUT CONTROL OF CATERPILLAR ATTACK ON GROUNDNUT CROP,-     SG-
aphids in groundnut,spray Dimethoate 30 EC 2 mllit
Farmer asked query on Weather,5        9  10
LEAF SPOT AND SUCKING PEST,CHLOROTHALONIL 2MLLITREOR PROPICONOZOLE 05MLLITREROGAR 15MLLITRE
Asked about nutrient management,Recommended to spray Chlorpyriphos 20 EC- 20 ml per lit water
TELL MESSAGE INFORMATION  STOP,kisan gov stop    -51969
thrips,actra
fertilizer in ground nut,Trichoderma viride 4 gram kilogramg beej ko upcharit karke buwai kare
Tobacco caterpillar,dimethoate 30 EC 2ml per litre of water
FARMER ASKED ABOUT VARIETIES OF GROUNDNUT,-             -    -   - -
fertilizer doses in groundnut,recomended as per shedule
LEAF EATING CATERPILLAR,CHLOROPYRIPHOS 2MLLTR
groundnut season details,groundnut season june - july
ASKED FOR:PEANUT SUCKING PEST,ASKED FOR:PEANUT SUCKING PESTRECOMMENDED:SPRAY DIMETHIOATE 2MLLT OF WATER
TELL ME TERMITE CONTOL IN GROUNDNUT,USE CHLOROPYRIFOS 20 EC 4 LITER PER HA WITH IRRIGATION
groundnut tikka leaf spot management,groundnut tikka leaf spot management : RECOMMENDED TO SPRAY HEXACONAZOLE  400 ML PER ACRE
MANAGEMENT OF NUTRIENT DEFICIENCY IN GROUNDNUT,RECOMMENDED TO SPRAY AGROMINMAX 3 GR1 LITRE OF WATER
ASKING ABOUT CONTROL OF STEM ROT OF GROUNDNUT,SPRAY COPPER OXYCHLORIDE 50 WP   4 GM  LIT OF WATER
TELL ME CONTROL OF WHITE GRUB OF GROUNDNUT,USE QUINOLFOS 5 G 25 KG PER HA IN SOIL FOR CONTROL OF WHITE GRUB IN GROUNDNUT
STEM ROT IN GROUNDNUT,RECOMMENDED TO DRENCH RIDOMIL 25GM  PLANTOMYCINE 1GM  1 LITER OF WATER
Ask about growth issue in groundnut crop,-                                                 -              -
Ask about weed control in ground nut crop,60       Shaked
FERTLISER IN GROUND NUT,8 KG UREA PER BIGA
Farmer wants to know information about how to control of defoliators attack in  ground nut crop,40 EC   4 EC   EC  40 ml
asking about MN mixture application for groundnut,recommended for Apply TNAU MN mixture 125 kg ha
good variety paddy for upper land,turanta  prabhat  richariya sarj saket-4
White grubs in Groundnut,Recommended to apply carbofuran 3G  3 g per plant or 10 kg per 1 acre of land to control White grubs in Groundnut
ASKED FOR MANAGEMENT OF GROUNDNUT APHIDS,RECOMMENDED-SPRAY DIMETHOATE AT 2ML IN 1 LITER WATER
ASKED ABOUT TO INSECT CONTROL,-- 5     2-3
asking about Weed management in Groundnut,:    :       20
groundnut bud necrosis,recommended for spray monocrotophos 2mllit and coconut leaf extract
TELL ME WHITE GRUB IN GROUNDNUT,SPRAY OF FIPROLIN 5  2 LITER PER HA
ASKING about Tobacco caterpillar management for groundnut,recommended for the spray   profenophos  2 mllit  of water
TEL ME SEED TREATMENT OF GROUNDNUT,-   2GM  KG    CLORPIRIPHOS 6 ML  KG   RIZOBIUM CULTURE 600 GM PER
Asking about Groundnut tobacco cutworm management,:     :    - 4  10
Ask about JAU Contact number SSK,-
tikka disease management in ground nut,RECOMMENDED TO SPRAY CHLOROTHALANILKAVACH DACONIL BRAVO  400 GRAMS PER ACRE
NUTRIENT MANAGEMENT IN GROUNDNUT,NUTRIENT MANAGEMENT IN GROUNDNUT:RECOMMENDED TO SPRAY POTASSIUM NITRATE  5 GRAMS1 LITRE OF WATER
Asking about suitable groundnut varieties in  Dharmapuri,:         :  TMV 10 COGn 5 TNAU CO 6  VRIGn 7
FERTILIZER USAGE IN GROUNDNUT,200                45
attack pest,Spray Actra 5 gm15 Lit of Water
FARMER ASKING INFORMATION REGARDING FARMER QUERY  OVERALL CALL IS AVERAGE,-                    -
Groundnut tobacco caterpillar control,Recommended for spray Chlorantraniliprole 5 ml  10 litre of water
groundnut basal chemicals,RECOMMENDED TO APPLY PHORATE GRANULES THIMMETFORATEX YAMMET 5 KG PER ACRE
Asked about Groundnut weed management,:    :  - 1     200      3
TELL ME SEED TRITMENT IN GROUNDNUT,USE CARBENDAJIM 2 GMCLOROPAYRIPHOS 4 ML PRATI KILO SEED
TELL ME WEATHER INFORMATION,Partly cloudy sky with possibility of rain or Thunderstorm or Duststorm
Farmer asked query on Weather,24     18
ASK FOR GROUNDNUT SEED TRITMENT INFORMATION,SUGG TO RAYZOBIYAM 250 GRAM10 KG SEED
Farmer asked fungus control information of Groundnut Crop,WP  35
TELL MESEED  TREATMENT  IN GROUNDNUT,25
Tobacco caterpillar control in groundnut,Recommended for spray profenophos 3 ml liter of water
-TELL ME ABOUT TERMITE CONTROL IN GROUNDNUT,20  4
asking about groundnut foliar application information,Recommended for Foliar Spray of Pink-Pigmented Facultative Methylotrophs PPFM Methylobacterium 10 ml  1 liter of water
Asked about weed management in groundnut,:     :
Farmer need information regarding control measures of blast disease in groundnut crop,Recommended for spray hexaconazol 5 EC 400ml at per Acer
Asked about groundnut root rot managment,2
Ground nut pre emergence herbicide,Recommended for spray Fluchloralin 800 mlac
GROUNDNUT SEEDS VARITIES,RECOMMENDED TO KADIRI -6KADIRI- BOLD KADIRI-9 KADIRI ANATHA
TELL ME WHIT  GRUB   CONTROL        IN GROUNDNUT,USE QUINOLFOS 5 G 25 KG PER HA IN SOIL FOR CONTROL OF WHITE GRUB IN GROUNDNUT
TELL ME TERMITS CONTROL IN GROUNDNUT,CLOROPIRIFOSH 20 EC 1 LITERBIGHA
Asked about groundnut and sesame sowing season information,:        :  -
ask about weedicide application,i suggested  do not use weedicide in standing crop
GROUND NUT MGMT,SAAF 500 GRACRE AND CHLORIPYRIPHOS 25 MLLT WATER
weeds,glicoset 2gl
ask for groundnut fertilizer dose,sugg to 10 kilo phoshpharash vigha
TELL ME ABOUT PEST IN GROUNDNUT,SPRAY OF FIPRONIL 5 SC 2 ML PER LITER WATER
fertilizer doses,zink sulphate
attack of rust on groundnut,spray redomil  gold 30 gm  15 liter of water for controlling  rust on groundnut
groundnut sucking pest,recommended for spray neem oil 5 ml  acephate 15 grams 1 liter of water
Information about varieties of Groundnut,:-
Attack of White Fly,Spray Pegasus 25 gm 15 liter of waterDiafenthiuronSyngenta
Give information about groundnut cultivation,4-5
Farmer asked query on Weather,:  T        :              33C -26C     8
sowing season for ground nut,Apr  May
Asking about Groundnut wilt management,Recommended to spray Carbendazim 2 gm  liter of water
FARMER ASKED ABOUT WEATHER REPORT FOR GROUNDNUT CROP,-            -        -        -
TELL ME CONTROL OF TERMITE  IN GROUNDNUT,USE IMIDACHLOPRID 178 SL 1 LITER PER HA WITH IRRIGATION FOR CONTROL OF TERMITE
groundnut white fly,recommended for spray spiromesifen 2 ml  neem oil 3 ml  teepol 1 ml  1 litre of water
groundnut seeds in subsidy,--recommended to contact vaa village agriculture assistance
Groundnut season at Tiruvannamalai dt,Recommended for season September - October
Variety of groundnut,Variety of groundnut-sb-11phule unapphule unatijl-501
groundnut leaf eating cater piller,recommended for proclaim 100 gracr
Ask about yellowing leaves of groundnut,SC
Farmer asked fertilizer dose in Groundnut crop,7
Farmer asked Larvae control information of Groundnut crop,GR
groundnut basal fertilizer management,apply DAP 50kg  zypsum 75kg  ac
groundnut pest,Chlorpyriphos 2mlltr
Asking about groundnut sowing spacing information,Recommended for Adopt a spacing of 30 cm between rows and 10 cm between plants
TELL ME BLACK ROOT CONTROL IN GROUNDNUT,USE TRICHODERMA 25 KG PER 100 KG COW DUNG
FERTILIZER DOSE,GIVE 4KG UREA  8KG POTTASIUM IN ONE ACRE
leaf spot,M-45 Or Saff
ask for gnut grub,suggest chlorpriphos 25 litha
weed control,weed control - weeding should be done
Farmer asked query on Weather,SHERGARH
asked about nutrient Management,asked about nutrient Management
Attack of Thrips,Spray Ullala 8 gm15 Lit of Waterflonicamid-UPL
TELL ME WEED CONTROL IN GROUNDNUT,PENDEMETHELIN 3LITTERHECTOR
ASKING ABOUT CONTROL OF COLLAR ROT IN GROUNDNUT,SPRAY   THIOPHANATE METHYL 70 WP  1 GM    LIT OF WATER
Asked about nutrient management in  groundnut,suggested to apply samruddi 2mll
Asking about Root rot Management For Groundnut,:      :  1     20
ASKED ABOUT TO DISEASE CONTROL IN   GROUNDNUT,259   1
Asking about Adult moth management in Groundnut,:    :
Asked about Plant protection in groundnut,Recommended to spray Chlorpyriphos  2 mlltr of water
Farmer asked Army worm Problem in  groundnut crop,SC 7-8
Can i do lime application in groundnut field after ground nut sowing,No you can not do lime application in groundnut field after ground nut sowing
ASKED ABOUT TO DISEASE CONTROL IN,-- 70   5    2
Farmer asked fungus in root control information of  GROUNDNUT,WP
TELL ME YELLOWING CONTROL IN GROUNDNUT,SPRAY OF FERROUS SULPHATE 5 GM  2 GM CHUNA PAR LITAR WATER
Attack of Thrips and Jassids,Spray Tata manik 7 gm15 liter of waterAcetamapride20SP-Tata Rallis
Asking about Alternaria leaf in groundnut,Recommended for spray Carbendazim  2 gram  litre of water
ASKED ABOUT TO INSECT CONTROL IN GOUNDNUT,30  2
Weather information,kisan bhai apke yahan 16 july se lekar 22 july tak hlki bunda-bandi ki sambhavana hai
Asking about stem rot disease management in groundnut,:           :  2
Ask for problem in groundnut,suggest:hirakashi powder 100 gmleman flower 10 gmpump sprey
HARBICIDE FOR GNUT,APPLICATION OF PARSUIT FOR GNUT CROP HARBICIDE
Asking about pseudomonas and trichoderma viride application for groundnut,Query : Asking about pseudomonas and trichoderma viride application for groundnut Answer :Recommended for apply  pseudomonas -1 kg and trichoderma viride -1 kg mixed with 25 kg of farmyard manure acre
Farmer asked query on Weather,37       18
FARMER ASKED SEED TARTMANT IN GROUNDNUT,12  2       5
ASKING ABOUT  WEATHERRAIN FALL REPORT IN HOWRAH DISTRICT,MOSTLY CLOUDY AND NO RAIN FALL
FARMER ASKED ABOUT ATTACK OF SUCKING PEST  ON  Groundnut,---
TELL ME GURD BEETAL IN SOYABEAN,SPRAY OF TRAIZOPHOS 25 MLLTR WATER
WEED MANAGEMENT,RECOMMENDED TO SPRAY PENDIMETHALINSTOMP 1-125 LITREACRE
Asking about can be used as a pesticide mixed with groundnut rich,:        :
Top dressing fertilizer for ground nut,Recommended for apply urea 20 kg potash 10 kg mn mixture 5 kgac
Farmer wants to know information about how to control tuber blight in groundnut crop,--
Farmer asked Larvae and Sucking pests control information of  Groundnut,126    95  ZC
groundnut flowering,recomended for multi k 1kgacr
WEED CONTROL IN GROUNDNUT,NO WEEDSIDY IN STANDING 50 DAYS CROP
ground nut growth development,recommended to spray multi-k 1 kg  acre
TELL ME  CONTROL OF WHITE GRUB,USE QUINOLPHOS 25 EC 4 LITER PER HA WITH IRRIGATION FOR CONTROL OF WHITE GRUB
Blight Attack,Antracol 30gm15 lit of water spray
Farmer asked Larvae control information in Groundnut crop,WP 20
fertilizer dose,dap
TELL ME ROOT ROTE OF GROUNDNUT,TRIKODERMA 25 KG  HACTEIR
weed control in the groundnut,mung fali me nirai-gudai karaye
Ask for groundnut varieties information,i suggest to visit Gujarat State Seed Nigam limited
SEED RATE OF GROUNDNUT,22 KG TO 25 KG SEED GROUNDNUT
LEAF EATING CATTER PILLAR IN GROUNDNUT,RECOMMENDED TO SPRAY CHLOROPYRIPHOUS 2ML LIT WATER FOR CONTROL OF LEAF EATING CATTER PILLAR IN GROUNDNUT
fertilizer,25kg gypsum urea
ZINC DEFICIENCY CONTROL IN GROUND NUT,--RECOMMENDED TO SPRAY ZINC SULPHATE 2 GRAMS  1 LITRE OF WATERUREA 10 GR 1LIT WATER
MASIK PATRIKA OF KARSHI AHARAN VITARAN ADHIKARI KARSHI AYUKTALAYA KARSHI PANT BHAVAN KAMARA NO-250 JAIPUR 12 RUPYE DEMAND DRAF BHEJO,MASIK PATRIKA OF KARSHI AHARAN VITARAN ADHIKARI KARSHI AYUKTALAYA KARSHI PANT BHAVAN KAMARA NO-250 JAIPUR 12 RUPYE DEMAND DRAF BHEJO
WEED MANAGEMENT IN GROUND NUT,RECOMMENDED TO SPRAY PROPAQUIZAFOP 250-MLACRE
Asking about Groundnut  Top dressing fertilizers,:     :   - 2  200
LEAVES ARE YELLWOSIH IN GROUNDNUT CROP,SPRAY FERASH SULPHET 5 GML WATER
SMS Activation,SMS Activation process completed
Asking about Early leaf spot in groundnut,:      :        1
Ask about weed management in groundnut,-     - 5 EC   25-30
TERMITE IN GROUNDNUT,TERMITE IN GROUNDNUT --RECOMMENDED TO SPRAY CHLOROPYRIPHUS DUST 10 KGACRE FOR CONTROL OF TERMITE IN GROUNDNUT
information about seed rate of Groundnut,30            35
Asked about humic acid  profenophos application method  dosage in groundnut,:     :   2 ml
ask Abt yellowish leaves,100 gm urea per punp
tell me FERTILIZER IN GTNUT,TAKE IN ZINK SULPHET 25 KG BEGHA   UREA  4 KG BEGHA
Asking about rat management for groundnut field,:       : :                  2    - 95    2   1
Farmer asked query on Weather,:   -      : :             30  C    22  C     8
TELL ME BLACK ROOT CONTROL IN GROUNDNUT,DRENCHING OF CARBENDAZIM 1 KG PER HA IN ROOT ZONE
TELL ME DISEASE CONTROL GROUNDNUT,USE HEXACONAZOLE 5 EC 1 LITER PER HA WITH IRRIGATION
Groundnut seed treatment information,Recommended for Treat the seeds with Pseudomonas fluorescens  10 gkg seed
give the information about weather forecast,light rainfall chance in your district and weather will some cloudy
ASKED ABOUT CULTIVATION OF GROUNDNUT,- -  -      -    -  -  -     -   10
ASKED ABOUT TO INSECT CONTROL IN   GROUNDNUT CROP,5   1-15    3
ask for gnut culture,suggest:rizobium culture
Tobacco caterpillar in groundnut,Recommended for spray fipronil 15 ml lit of water
ASKED ABOUT TO INSECT CONTROL IN  GROUND NUT,5   1    3
ASKED ABOUT TO CONTROL OF FLOWER DROPING IN COTTON CROP,45   1    4
ASKED ABOUT TO NUTRIENT MANAGEMENT  IN GROUNDNUT,33 5   10
Asking about weed management for groundnut,Recommended for hand weeding on 15 and 30 th days of sowing
The farmer asked about adding zinc to the crop,5
leaf cutter pilar,chloropyriphous 2mllit water spray
TELL ME ABOUT CATERPILLER CONTROL IN GROUNDNUT,SPRAY OF TRIZOPHOS 40 EC 2 ML PER LITER WATER
GROUNDNUT SUCKING PEST MANAGEMENT,RECOMMENDED TO SPRAY THIAMETHOXAM 03 GRAMS  LITRES OF WATER
Asking about Root rot management in groundnut,INCOMPLETE CALL
gnut yellowinmg leaf control,spray hirakachi powder 100 gm10 gm citric acid
FARMER ASKED QUERY ON SEED TREATMENT IN GROUNDNUT,RECOMMENDED TO TREAT 1 KG OF SEED WITH 3 GRAMS CARBENDAZIM OR 3 GRAMS MANCOZED
ASKED ABOUT PLANT PROTECTION,When pest appears of sesamumgreen gram dust Fenvalerate 04 D  4 kg or Malathion 5 D  8 kgacre during morning hours
LEAF CURL IN GROUNDNUT,RECOMMENDED IMIDACHLOPRID  1ML3LITRE SPRAY
white grub management in groundnut,RECOMMENDED TO APPLY  PHORATE  10G GRANULES  6 KG PER ACRE
SEED RATE OF GROUNDNUT,RECOMMENDED SEED RATE OF GROUNDNUT - 36KGACRE
farmer asked about Dhanzyme Gold uses and spraying time in groundnut,Dhanzyme Gold Biologically derived Organic Manure is an organic manure derived biologically from sea grass Dhanzyme Gold contains essential elements for healthy plant growth and  enhance the crop yields as well as its quantityOne spray  After 40 days of sowing    200 ml acre
Farmer asked query on Weather,28
ask for larva in gnut,spay novalurn 10 ml per pump
Farmer wants to know information about seed treatment to control white grub in groundnut crop,48 FS  8  10           l
FARMER ASKING WEED MANAGEMENT IN GROUNDNUT,-
TELL ME DISEASE CONTROL IN GROUNDNUT,DRENCHING OF CARBENDAZIM 1 KG PER HA IN ROOT ZONE WITH IRRIGATIONUSE QUINOLPHOS 25 EC 4 LITER PER HA WITH IRRIGATION FOR CONTROL OF WHITE GRUB
ASKED ABOUT TO  DISEASE   CONTROL  IN  GROUNDNUT,GROUNDNUT      80  2
TELL ME CONTROL LEAVES BORAR OF GROUNDNUT,SPRAY AMIDA CALOROPID 12MLLITTER WATER
STEM ROT IN GRUNDNUT,SPRAY HEXACONAZOLE 5 EC  15MLLIT OF WATER
FERTILIZER SPRAY FOR GROWTH,This week weather is CLEAR SKY and  NO possibility of rainfall
Farmer need information regarding control measures of fungal attack in groundnut crop,40     2    15
ASKED ABOUT TO CONTROL OF INSECT IN GROUNDNUT,40   4    15
TELL ME LAT OF GROUNDNUT,CLOROPYRIFOS 1 LITER  BIGHA
FOR CONTROL OF WHITE GRUB,USE QUINOLPHOS 25 EC 4 LITER PER HA WITH IRRIGATION FOR CONTROL OF WHITE GRUB
weed control in groundnut crop,you can spray imizathiper 2 mili liter water use for weed control in groundnut crop
Asking about Increase yield for groundnut crop,:       :     2        200
TELL ME ABOUT COLLAR ROT IN GNUT,1
information regarding sowing of groundnut,crop not sown there
NUTRIENT MANAGEMENT IN GROUNDNUT,USE SULPHUR 90 10 KG PER HA
Aphids in groundnut,- spray dimethoate 2 mllitre
Asked about Leaf eating Caterpillar management in Groundnut,:      :  3   1
ASKED ABOUT THE SOIL TYPE FOR SOWING GROUNDNUT,RECOMMENDED SOIL TYPES ARE SANDYRED SOILS
leaf folder in ground nut,spray monocrotophos 2 ml  lit of water
GROUNDNUT PODBORER,RECOMMENDED TO LAKAR 1MLLIT
ASKED ABOUT VARIETIES OF GROUND NUT,VARIETIES OF GROUND NUTDAPTARITAJ 24TG 26
give the information about weather forecast,today no possibilitis of rain and 14 to 16 august weather are cloudy and chances of light rain
fertilizer management in groundnut,apply gypsum  ac
Ask about fungus problem in groundnut crop,12    63  WS      WP         -                     2
Farmer asked query on Weather,3           13
groundnt weed management,RECOMMENDED TO SPRAY PENDIMETHALINSTOMP 1-125 LITREACRE
ground nut pest,imidacloprid 05 ml per liter
root rot in ground nut,recomended to spray copper oxy chloride 300grams  20 grams streptocyclin acre
tikka diseases on ground nut crop,you can spray redomil gold 30 gram polatrin 40 mili pamp water use for tikka on groundnut
ask about fungus in groundnut,i suggest mencozeb 35grampump spray
FERT DOSE FOR GNUT,65 KG SUFLA   65 KG SUPER PHOSPHATE
TELL ME GROUNDNUT RATE CHOMU MANDI,4300 RU QU GROUNDNUT RATE
