QueryText,KccAns
CONTROL OF  LEAF EATING CATTER PILLER IN  GROUND NUT,SPRAY  LAMDASYHALOTHRIN   250 ML  ACRE
tell me pest control in groundnut,USE QUINOLFOS 5 G 25 KG PER HA IN SOIL FOR CONTROL OF WHITE GRUB IN GROUNDNUT
Farmer want to know how to control sucking pest of crop,Recommended for spray of Dimethoate Rogar  30 ml per 15 litter water
TELL ME NUTRIENT MANAGEMENT,2   2   3
Farmer asked seed treatment of fungus problem in ground nut crop,WG
pea nut leaf eating catterpillar,spray dimethioate 2mllt of water
Asking about season for groundnut,recommended season for groundnut is Nov- Dec
FERTILISER MANAGEMENT IN GROUNDNUT,APPLY 150 KG GYPSUMAC
Asked about Leaf caterpillar and Sucking Pest management in Groundnut,:         :  2    1
STEM ROT,SAAF 2GMPLANTOMYCIN 1GM1L OF WATER
asking about control of tikka disease in ground nut,SPRAY COPPER OXYCHLORIDE 50 WP  4 GM  LIT OF WATER
Asked about plant protection in  ground nut,Suggested to spray 1 g Carbendazimlit water
ROTTING IN GROUND NUT,SPRAY SAAF 2 GM IN 1  LITRE OF WATER FOR ROTTING IN GROUND NUT
FLOWAR DROP IN SOYABEEN,SPRAY OF PLANOFIX 1 ML PER 4 LITER WATER FOR CONTROL OF FLOWER DROPING
ground nut Tobacco caterpillar management,recommended for spray  chlorpyriphas 2 ml  lit of water
Asked about plant protection in  groundnut,Suggested to spray:- Quinolphos  2mllit of water
Asking about Nutrient Management of groundnut,-
TELL ME  INSECT CONTROL IN GROUNDNUT,USE QUINOLPHOS 15 DUST 25 KG PER HA MIX IN SOIL
ASKING ABOUT SEED TREATMENT OF GROUNDNUT,APPLY  CARBENDAZIM 50 WP  PER 1KG SEED 2 GM NEED TO MIXED
TELL ME TERMITE CONTROL  IN GROUNDNUT,USE QUINOLPHOS 25 EC 4 LITER PER HA WITH IRRIGATION FOR CONTROL OF WHITE GRUB
Asked about Leaf caterpillar and jassids management in Groundnut,:        :  2
Farmer asked fungus control information of groundnut crop,25   25 SC
seed treatment in Groundnut,Carbendazim should treat 50 WP  2 grams of quantity  kg at the rate of seed
farmer once information related to water management in groundnut crop,20
ASKED ABOUT TO SEED REEATMENT IN GROUNDNUT CROP,2
FERTILIZER MANAGEMENT IN GROUNDNUT,RECOMMENDED DOSAGE GYPSUM 200 KG  ACRE
Leaf Eating Catterpilar,Spray Polo 5ml15 Lit of Water
Ask about larvae  sucking pests,Suggested: profenofos 40  cypermethrin 4  15 mlpump spray
Ask about larvae control information,Suggested: Novaluron 10 EC 25 mlpump spray
ask about maturity days of Gujarat groundnut 20 groundnut varieties,-
Asking about Pre emergence weed management for Groundnut,:          :    800   3
Asking about Rat control management in Groundnut  field,:       :
Ask about larvae control information in groundnut,SC 7-8
yellowing leaf in ground nut,recommended to spray zinc sulfate 400gramacre
FARMER ASKED ABOUT ATTACK OF BLIGHT ON GROUNDNUT,:-        30
TELL ME LEAF MINER CONTROL IN GROUNDNUT,SPRAY OF INDOXACARB 145 SC 1 ML PER LITER WATER
GROUNDNUT AFFECTED BY WHITE GRUB,GIVE PHORET 20-25KG HEC
Asked about Pradhan Mantri Kisan Samman Nithi scheme,:         :
ask about fungus problem in peanut crop,WP -           WG   WS 8
Farmer want to know information about how to control sucking pest in groundnut crop,dimethoate 30 EC 500 mlha
Asked about caterpillar management in groundnut,:      : :      2
Farmer asked Larvae control information of groundnut crop,EC 15
season,june july is best season
variety of groundnut,groundnut- phule pragati kopargaon - 1
verities,GROUNDNUT --- TMV-2 JL-24
TELL ME ABOUT THE CONTROL OF FUNGAL INFECTION IN  GROUNDNUT,2
TELL ME ABOUT DISEASE CONTROL IN GNUT,-- 12   63    2
TELL ME CONTROL SUCKING PEST OF GROUNDNUT,SPRAY DAIMETHOIT 30EC 2MLLITTER WATER
Asked about Gypsum application for Groundnut,:      :  80    4
TELL ME WEATHER INFORMATION OF NAGAUR,LIGHT RAIN MAY BE NEXT 5 DAYS
want to treat peanut seed,50   2
Asking about leaf spot in groundnut,:     :   2
Ground nut post emergence herbicide,Recommended for Ground nut post emergence herbicide Imazethapyr  300 mlac
WHITE GRAB IN GROUNDNUT,SPRAY OF IMIDACHLOPRID 175 SL 05 ML PER LITER WATER
Asking about groundnut Thrips management,Recommended for spray Dimethoate 2 mllit of water
basal fertilizer management for groundnut,apply DAP 50 KGac
weed management,spray persuit 15 litar  ha
NUTRIENT MANAGEMENT IN GROUND NUT,RECOMMENDED TO GYPSUM 200 KG ACRE IN PEGGING STAGE OF GROUND NUT
ABOUT COLAR ROT  WHITE GURB,TRICHODERMA 25 KG MIX WITH COW DUNG 100 KG USE   HA
CULTURE ACTIVITIES IN GROUND NUT,CALL DIVERTED TO AGRICULTURE FTA
Groundnut leaf folder and leaf spot control,Recommended for spray Azadirachtin 3 ml  1 ml teepol  1 g carbendazim  lit of water
Asked about groundnut crop nano urea spray,500
ASK ABOUT THE FERTILIZER,SUGGESTED FOR THE RECOMMONDATION FOR THE CROP
Asking about Weed management for Groundnut,:         :  2040-
TELL ME WEATHER INFORMATION,RAIN POSSIBILITY IN NEXT 2-3 DAYS OR CLOUDY SKY
weed in grnut,weed in grnut-weeing should done
asking for the tobacco caterpillar management in groundnut,recommended for the spray of profenophos at the rate of 2 ml in 1 litre of water
ask for gnut fertilizer information,I suggested no requirnment at 27 days
ask about white grub in ground nut,I suggested to give chloropyriphos 4lit ha with irrigation for white grub in ground nut
Farmer asked query on Fertilizer management in  Groundnut,Recommended to  apply urea 20 kg  200 kg gypsum
Stem rot for groundnut,recommended for soil Dreching with copper oxychloride 25 glit
Attack of Caterpillar,Spray Chloropyriphos 30mlml 15 Lit of Water
Asking about Root grub management in groundnut,:      :   2     40
FARMER ASKED QUERY ON ROOTGRUB IN GROUNDNUT,RECOMMENDED TO DRENCH CHLORPYRIFOS 6 ML1 LITRE  OF WATER   6   1
Farmer asked fungus control information of  groundnut crop,12    63  Ws
Insect Problem In Pea Nut,Emmamectin Benzoate 5 SG Dose 100 gm per acre
groundnut me deemak ke problem,apply chlorpyriphos -1 lit acre
Ask about Plant Growth Retardant Information in Groundnut crop,30-40
Asking about organic fertilizers application in groundnut,:       :          25
Farmer Asked sucking pests control information of ground nut crop,WG -                 25
GROUNDNUT HELICOVERPA DAMAGE,RECOMMENDED TO SPRAY MONOCHROTOPHOS 16 MILLI LITER  LITER WATER
weed management in groundnut,Not recommended to use any herbicides to groundnut
ask for sesamum larva,suggest:corazen 5 milpump sprey
TELL ME APHID CONTROL IN GROUNDNUT,SPRAY OF ACEPHATE 2 GMLITRE
TELL ME ABOUT WEATHER INFORMATION HANUMANGARH,LIGHT  RAIN POSSIBILITY IN NEXT 3-4 DAYS BUT CLOUDY SKY
ask about larvi in groundnut,I suggest chloropiriphos 30mlpump root spray
ask about white grub in ground nut,I suggested to drenching chloropyriphos for control white grub in ground nut
TELL ME GROUNUT SEED TRITMENT,USE IMIDACHLOPRID 178 SL 05 ML PER LITER WATER IN ROOT ZONE
Asked about Nutrient management in  groundnut,General necessary information  on growth regulator
NOT GROTH FOR GROUNDNUT,500 KG GEMASAMHE
TELL ME FOR CONTROL OF WHITE GRUB,USE QUINOLPHOS 25 EC 4 LITER PER HA WITH IRRIGATION FOR CONTROL OF WHITE GRUB
TELL ME WHITE GRUB IN GT NUT,IRRIGATION WITH QNALPHOS 4 LT  HA
GROUNDNUT RUST,RECOMMENDED TO SPRAY CHLOROTHALONIL 400 GRAMS  ACRE
leaf eating caterpillar in groundnut,recommended for spray chloripyriphos 2 ml  liter
Ask about fertilizer Dose,BASAL DOSE - AMMONIUM SULPHATE  80KG  SSP 150KG
aphid problem in groundnut,spray of dimethoate 15 mlliter of water
WEED CONTROL IN GROUND NUT,USE IMIZATHAPER 100 GRAM PER BIGHA
groundnut fertilizer management,recommended for apply urea 10 kg dap 1 bag mop 10 kg acre
FARMER ASKED ABOUT FLOWER DROP,SPRAY PLANO FIX 3 ML 15 LITER WATER
all information provided - thanks for calling in kisan call centre,all information provided - thanks for calling in kisan call centre
Groundnut fertilizers,Appaly potash 30kgacre
color rot control,trichoderma 25m kg 100kg fym
blight  or Wilt,Spray Redomil Gold 45 gm15 Liter of
asked about sowing time for ground nut,sowing time for ground nut - 15 january - 15 february
TELL ME WEATHER INFORMATION,RAIN POSSIBILITY UPTO NEXT 5 DAYS
Asked about leaf feeder management in groundnut,:      :    4       10
Farmer asked weed control in Ground Nut crop,-- 9  EC    -     Gr
TELL ME ABOUT OF SEED TREATMENT IN GROUNDNUT,2
Farmer asked query on Weather,:   -      : :            36  C    25 C     8
Farmer asked query on Weather,WEATHER REPORT  THERE IS A CHANCE  OF CLOUDY WEATHER OCCUR IN YOUR AREA
groundnut me kida laga hai,Imidacloprid 2 milliliter davaliter  pani me gho kar spray kare
Asked About SMS Activation,Spray Boom flower 20ml15lit of Water
VARIETY,SB 11
Ask about fungus problem in groundnut crop,SC -
ASKED ABOUT WEED MANAGEMENT IN GROUNDNUT,-
LEAF EATING CATTERPILLER OF GROUNDNUT,RECOMMENDED TO SPRAY SPINOSADTRACER SPINTER  CHARGE   75 ML200LWATER   PER ACRE
TELL ME ABOUT TIKKA DISEASE CONTOL IN GROUND NUT,SPRAY OF CARBENDAZIM 12  MANCOZEB 63 WP 2 GM PER LITER WATER
Asking about Groundnutrich spray,:     :     2  200
asked about groundnut - fertilizer use,gypsum 1 bag  acre
fertilizer dose for groundnut,urea 25 kilo gypsum 50 kilo acre
wilt,use foret 10 kg  acre for wilt gnut crop
CONTROL OF TIKKA DISEASES IN GROUNDNUT,SPRAY CARBENDIZAM  1 GM LIT WATER
insect problem in groundnut,Triazophos 40 EC  800 ml acre ke hisab se pryog kre
TELL ME ABOUT WEED CONTROL IN GROUNDNUT,SPRAY OF PENDIMETHILIN 3 LITER PER HA AFTER SOWING BEFORE GERMINATION
ASKED ABOUT TO INSECT CONTROL IN COTTON AND GROUNDNUT CROP,178  05
Ask about larvae control informatio,nSuggested: Emamectin benzoate 5 SC 8 gmpump spray Very costly
Root rot management in ground nut,Recommended to spray copper oxi chloride 600 grams  20 grams streptocyclinacre
control of caterpillar attack,spraying of chloropayrifos 30 mili  15 liter water
Ask about seed treatments,10 kg seeds  for termite and white grub protection
WEED MANAGEMENT IN GROUND NUT,APPLY TARGA SUPER 2 MLLITER OF WATER
leaf eating catterpllar in ground nut,spray spinosad 1  ml in 3  litre of water for leaf eating catterpllar in ground nut
Asking about Groundnut pest incidence spray pesticide now again spray insecticide,:           :
tobacco caterpillar in Groundnut,Recommended for spray profenophos 2ml  teepol 1ml  neemoil 3mllit of water
weather report,Partly sunny and pleasant
soing time of groundnut,july me moongfali lgaye
Ask about sucking pests problem in Cumin crop,150    15
Asking about Leaf Caterpillar management in groundnut,:     :  2   1
moongfali me patte par kale dhabbe pad rhe hai,mancozeb 64   2gmlitre or trichoderma viridi 3gmlitre pani me ghol kar spray kre
TELL ME CUT WORM CONTROL IN  GROUNDNUT,145   1
Ask about sucking pests problem in crop White Fly Jassids Aphids  Thrips,20   7
asked about variety of ground nut,variety of ground nut - sb-11 phule pragati
FARMER ASKED ABOUT TO NUTRIENT MANAGEMENT GROUNDNUT,SSP -375
mugfali me khad ki matra batai,30 kg dap30 kg potashacre dalia
ASKED ABOUT CONTROL OF WILTING IN GROUNDNUT,:               -
LOW GROWTH OF G NUT,APPLY UREA 2 KG  BEEGHA
groundnut variety,-  -  -    --     ------ -- -
TELL ME YELLOW ROG IN GROUNDNUT,FERESH SULPHATE 5 GRAM PAR LITER WATER SPREY
TIKKA DISEASE,SPRAY MANCOZEB 800GMACRE
MOONGPHALI KI VARIETIES,CHANDRACHITRAAMBAR
asking about thrips control in groundnut,recommended for Spray Fipronil 2 mllit of water
TELL ME ABOUT THE SEED TREATMENT IN GROUNDNUT,30FS 5-8
CONTROL OF CATERPILLAR AND WHITEFLY IN GROUNDNUT,RECOMMENDED FOR SPRAY CHLORANTRANILOPROLE 185  SC   1 ML   3 LIT OF WATER
Farmer asked seed treatment of fungus problem in GROUND  NUT,DS
APHID GROUNDNUT,RECOMMENDED FOR SPRAY ROGOR 2ML LIT WATER FOR CONTROL OF APHID PEST IN GROUNDNUT
Groundnut stem rot management,recommended for the spray  : carbandazem  2 gm lit of water
ASKED ABOUT WILT IN GROUNDNUT,-         30
ask for white grub in ground nut,suggest:2 lit chloropyriphose700 ml cypermethrin ha
ASKED ABOUT TO NUTRIENT MANAGEMENT ground nut,5    10
how to control termite in groundnut,apply to chloripyriphos 15lha
Asking about groundnut basal fertilizer management,:    : DAP 50       10
nutrient mangement,recommended 19OL SPRAY
Ask about Fertilizer application in Ground nut,100
ASKED ABOUT TO DISEASE CONTROL INGROUNDNUT,50  250
GROUNDNUT TABACCO CATERPILLER CONTROL,RECOMMENDED TO SPRAY ABAMECTIN DYNAMITE 160 ML PER  ACRE
Ask about irrigation information in Groundnut crop,-                                                                                                                                         -      -                                                                                                                                              -     -          -
aSKED ABOUT INSECTICIDES IN GROUNDNUT,-          EC
variety of groundnut,variety of groundnut -tag -24 phule pragati -11
variety of ground nut,variety of ground nut-SB -11TAG-24
Farmer asked Larvae control information of,SC 6   Coragen FMC
tell me pest control in,45   3
GROUND NUT FERTILIZER MANAGEMENT,RECOMMENDED TO APPLY GYPSUM 200 KG ACRE  45 DAYS AFTER SOWING
Ask about use fertilizer information of  groundnut crop,-   TAG -   TAG -
ask about varieties of ground nut,varieties of ground nut J L 24JL220
Farmer asked query on Weather,:    -       : :           30  C    22 C     8
ASKED ABOUT TO SEED RATE FOR GROUNDNUT,80-100
Asked about attack of jassids on groundnut,Spray Actra 5 gm15 Liter of WaterThiomithoxom 25-Syngenta
Asked about nutrient management,SUGGESTED TO APPLY Zinc sulphate- 4 kgacreBorax- 4 kgacreGypsum- 200 kgacre
Early leaf spot in Groundnut,Recommended for spray Carbendazim 2gm teepol 05mllit of water
FARMER ASKED QUERY ABOUT ON WHICH FERTILIZER IS BEST FOR TILLAGE TIME IN GROUND NUT,RECOMMENDED TO APPLY FYM 10-15 TONSACRE SSP AND MOP WILL BE USED IN GROUN NUT CROP FOR TILLAGE TIME
leaf feeder management in Groundnut,Recommended for spray Profenophos 50  EC- 2ml1 litre of water
Farmer asked query on  Borers  leaf miner in ground nut crop,RECOMMENDED TO SPRAY IMIDACLOPRID CONFIDOR 80 ML 200 LITRES OF WATER  ACRE
water management of gr nut,give irrigation after 8-10 days
farmer wants to know information about seed rate of groundnut,100
sucking pest,quinalphos 25 EC 2 mllit
Ask about fertilizer  dose in groundnut,-
leaf eating caterpiller in groundnut,RECOMMENDED TO SPRAY MONOCROTOPHOS
for controlling Caterpillar infestation in Ground nut,Recommended to spray Emamectin Benzoate 5SG  80gm per acre for controlling Caterpillar infestation in Ground nut
asked about Attack of White Fly on groundnut,-   gm         WG
GROUNDNUT WILT,Advised to drench the plant base with COC  30 grams  streptocyclin 1 gram per 10 liters  of water
groundnut pest,dimethoate 2ml in  1 liter water
TELL ME INSECT CONTROL,--   1   3
fertilizer,poptash  25 kg  and  dap 1 bag acre
Asking about groundnut top dressing fertilizer management,Recommended for apply gypsum 150kg borax 4 kg  acre
Tell me about Water requirement of groundnut,In rainy season Iriigation is not required but when Sufficient rainfall is not coming please give irrigation
Asking about groundnut top dressing fertilizer management,recommended for the fertilizers : urea 3kgpotash 6 kg gypsum 30 kgacre
blight on grnut,Spray Bavistine 30gm15lit of Water
asking which feertilizer use after sowing of gnut at 50 days,i suggested to can  40 kg per acer
lockout Herbicide used by Farmer for controlling Weeds In Groundnut Crop,Recommended to apply 2mllit of water and sprayed in Ground Nut Field
ASKED INFORMATION ABOUT GROUNDNUT,VARIETIES- SB-11
Ask about termiteNematodwhite grub control information,Suggested: Carbofuran 3G dusting 6 kgvigha
SUCKING PEST MANAGEMENT IN GROUNDNUT,RECOMMENDED TO SPRAY THIAMETHOXAM 40 GRAMS 200 LITRES OF WATER  ACRE
Asked about Groundnut germination period,:       :   5 - 10
ASKED ABOUT HERBICIDE IN GROUNDNUT,Goal 20 ml oxyfluorfen15 liter of water-Dow Agro
groundnut ma irrigation,give proper irrigation
leaf become yellow  root become black,drenching ridomil gold
APHIDS IN GROUND NUT,RECOMMENDED TO SPRAY IMIDACHLOPRIDE 5ML25 LITER OF WATER
Groundnut wilt management,Recommended for spot drenching with Carbendazim 1 gramlitre of water
Information about control of leaf eating caterpillars in  groundnut crop,Chlorpyrifos 50  Cypermethrin 5 ec  2
Asking about Aphid control management in Groundnut,:     :  2   1
Farmer asked about variety of groundnut,:
TELL ME KATRA CONTROL IN GROUND NUT,SPRAY OF PROFENOFOS 15 ML PER LITER WATER
Asked about plant protection in  groundnut,Suggested to spray carbendizim 1 g lt of water  chlorpyriphos 2 ml lt of water
pest,spray of karate  10 ml pump
seed treatment of groundnut,SEED TREATmet of bwastin  4 GM10 LTR WATER
Groundnut sucking pest,RECOMMENDED TO SPRAY CHLORIPYRIPHOS 25 MLLT WATER
Asking about caterpillar management in groundnut,:     : :      2
moongfali ki pattiya pili pad rhi hai,ap Mancozeb 1 gramliter pani ki dar se spray kare
TWELL ME TERMITE CONTROL IN GROUND NUT,USE IMIDACHLOPRID 178 SL 1 LITER PER HA WITH IRRIGATION FOR CONTROL OF TERMITE
Farmer asked query on Weather,:    -        : :           36  C    25 C     8
TELL ME NUTRIENT MANAGEMENT,SPRAY OF THIOUREA 05 GM PER LITER WATER
TELL ME WEATHER INFORMATION IN JALOR DIST,NO RAIFNALL NEXT FIVE DAYS
control of mava,spraying of admire 4 gm  15 liter water
GROUNDNUT THRIPS CONTROL,RECOMMENDED TO SPRAY ACETAMIPRIDE 40 GRAMS PER ACRE
Asked about plant protection in  ground nut,Recomended to spray imidacloprid  05 ml per lit of water
ASK ABOUT GUJARAT RAJYA BIJ NIGAM OFFICE CONTACT NUMBER,-  --  --
Asking about Kadhiri 1812 Groundnut seeds availability contact,:  1812     :
Farmer asked Aphid problem in Cotton crop,SP    SP
FARMER ASKED QUERY ON NUTRIENT MANAGEMENT IN GROUND NUT,RECOMMENDED TO SULPHUR-250 GRACRE IN GROUND NUT
Farmer Asked sucking pests control information of GROUNDNUT,ZC
ASKED ABOUT VARIETIES OF GROUND NUT,VARIETIES OF GROUND NUT-PHULE UNNATIS B -12T A G -24
Ask about fertilizer dose in Groundnut crop,:::
Farmer asked query on Weather,:          :      -                       33C    26C      8
Attack of  blight,Spray Takat 15 gm15 Liter of Water
control for hairy caterpillar in mung phalli,Monocrotophos 36 SL 2 ml litar pani ke sath spray kren
Farmer asked White Fly problem in Groundnut crop,SP        -       -
Farmer asked about how to stop further growth in groundnut,1ml
root rot management in groundnut,recommended to spray copper oxi chloride 600 grams 20 grams streptocyclin acre
asking about Groundnut season,Recommended for Groundnut season July-Aug
Farmer asked Thrips problem in crop groundnut,25
Asked about leaf feeder management in groundnut,:        :     2
FARMER ASKED ABOUT VARIETIES OF GROUNDNUT CROP,-     -  -  -
Fungus attack,Blue copper -40 gm 15 lit water
Ask about fungus control information in root of Groundnut,EC        -
TELL ME NUTRIENT DEFICIENCY,SPRAY OF MULTIPLAX MICRONUTRIENT 4 ML PER LITER WATER
Asking about nutrient management in groundnut,Recommended for planofix 140 ml10 lit
Farmer asked fungus control information of GROUNDNUT,wp
about management of the leaf eating caterpillar,RECOMMENDED TO SPRAY CHLORPYRPHOSKORBAN DURSBAN LETHAL  RADAR 500 ML PER ACRE
asked about TCP,recommended spinosad 75 ml200 lit of water
Farmer asked Army worm Problem in ground nut crop,ZC
TELL ME GROUNUT ROOT ROT DIEASE CONTROL,DRENCHING OF CARBENDAZIM 1 KG PER HA IN ROOT ZONE WITH IRRIGATION
Asked about Root grub management in Groundnut,:     :     4    10
leaf eating caterpillar in ground nut,spray quinalphoos 2 ml in 1  litre of water for leaf eating caterpillar in ground nut
ask for white grub,EC
For quality seed formation in groundnut,Recommended to spray Fantac Plus 1ml in 2litres of water for quality seed formation in groundnut
Thrips problem in mung,Spray metasistox  15 ml in 1 litre of water
tell me control colar rot diseases of groundnut,use-taraicodrma 25kgfym 100 kilogram hac
groundnut fertilizer information,at basal stage 12 kg per vigha
Farmer asked query on Weather,4                 4           10
top dressing for groundnut,Recommended for apply urea 25 kg  potash 15 kgac
Asking about Aphids in groundnut,Recommended for spray Dimethoate  2ml  litre of water
Sowing time for ground nut,Sowing time for ground nut - june to july
ask for gnut larva,suggest:coragen 5mlpump
Seed treatment for groundnut,Treat the seeds with Pseudomonas fluorescens 10gkg of seed
Asked about plant protection in GROUNDNUT,Suggested to spray--SAAF Carbendazim  Mancozeb   1gram per litre of water
Groundnut Diseases Information,-          -
Farmer asked query on Weather,15  20
Asked about Groundnut foliar spray,:     :   5
ATTACK OF LEAF EATING CATERPILLAR ON GROUNDNUT,SG-
caterpillar,spray chloropyriphos 2mllitre
FARMER ASKED ABOUT WILT ATTACK ON GROUNDNUT,--  45     30
Information about weed control in Ground nut,-
Asking about groundnut cake application for paddy crop,:       : 25      25
groundnut fertilizer use,apply   zipsum  200 kg  acre
ground nut disease,copper oxy cloride 2 gm per liter
TOBACOCATERPILLAR,SPRAYING OF MONO 16 ML  LIT OF WATER
Farmer asked Varieties information of Groundnut crop,:-  :-   -  TG-24  TGA-37   -  -
FARMER ASKED ABOUT VARIETY OF GROUNDNUT,1 - -            -    -  2 -
GROUNDNUT SUCKING PEST,RECOMMENDED TO SPRAY ACETAMIPRID   40 GRAMS  200 LITRES OF WATER ACRE
ask abt gnut crop,suggested all info
asking about the basal application and top dressing fertilizer dos of groundnut,:-    :-
TELL ME CONTROL  LAT IN GROUNDNUT,DIACLOROWAS 100 EC 2 MLPAR LITER WATER SPREY
asked about gnut market rate,gnut-
groundnut me sichai ki jankari,proper jankari di gai
ask about herbicide information in groundnutcottonsesame,30 EC                 37  CS
ask about fertilizer and fungus information in groundnut,WP
TERMITE IN GROUND NUT,APPLY CHLOROPYRIPHOS 2ML  LT WATER SPRAY
Asked about leaf folder  leaf blight disease management in groundnut crop,:           : 2     2
TELL ME MICRO NUTRIENT MANAGEMENT   IN GN,SPRAY OF MULTIPLAX MICRONUTRIENT 3-4 ML PER LITER WATER
asking about groundnut root rot management,recommended for soil application of Trichoderma viride 1 kgacre  mixed with 20 kg FYM
TELL ME BLCK ROTH IN MOONGFALI,USE CARBENDAZIM 250 GM BHEEGA IN ROOT ZONE WITH IRRIGATION
Asked about leaf folder management in Groundnut,:       :  2
insect problem in groundnut,Phorate 10 CG   8 -10 kg  acre ke hisab se pryog kre
weed problem in pea nut crop,mahoday ap moongphali me nirai gudai kara le
asking about Basal fertilizer management for groundnut,Recommended for apply DAP 40 kgpotash 12 kgacre
TELL ME WEEDS CONTROL IN GROUNDNUT,SPRAY OF PENDIMETHILIN 30 EC 25-3 LITER PER HA AFTER SOWING BUT BEFORE GERMINATION
TELL ME ABOUT INTER CROPING IN GROUNDNUT AFTER 20 DAYS OF SOWING,NO ANY  INTER CROP IN GROUNDNUT AFTER 20 DAYS OF SOWING
Ask about groundnut leaf yellow chlorosis problem,pump spray
gypsum time of application in groundnut,200                45
Farmer asked query on Weather,:       :        32       15
bud necrosis in ground nut,recommended to spray monocrotophos-2mllit of water
attack fangash,bavistin spray
yellowing leaves  of groundnut,Blue copper -40 gm 15 lit water
STEM ROT IN GROUDNUT,RECOMMENDED TO SPRAY SAAF 2GM  PLANTOMYCIN 1GM  1 LIT WATE FOR STEM ROT IN GROUDNUT
ask about the total  package and practice of g nut,I suggested total package and practices of g nut
alternaria blight in Groundnut,alternaria blight in Groundnut-spray ridomil-2gmlit of water
groundut ki prajati ki jankari,groundut ki prajati-Chandra chitrakosal
ASKED ABOUT OILSEED VARIETY,TAKE TAG 24 JL24
ask for groundnut  white grub information,suggest: drenching with cloropayrophose 250mlvigha
TELL ME CONTROL COLAR ROT DISEASES OF GROUNDNUT,USE-TARICODARMA 25KGHACFYM-100KGHAC
GROUND NUT THIKKA LEAFSPOT,HEXACONOZOL 2 ML  LITER
FARMER ASKED ABOUT SUCKING PEST ATTACK AND LARVAL ATTACK ON GROUNDNUT CROP,05  1
TELL ME EFFECTED BY WHITE GRAB,SPRAY OF FIPROLIN 5  2 LITER PER HA
Tobacco caterpillar in groundnut,Recommended for spray Indoxacarb 1 ml  lit
groundnut ka ped sukh raha hai,Carbofuran 3 GR 8 kilogram prati acre istemal kare
FARMER ASKED ABOUT FOR CONTROL ATTACK OF CATERPILLAR AND SUCKING PEST ON GROUNDNUT CROP,:-
Farmer asked information about water management practices for groundnut crop,-           -                          -                         -
TELL ME ABOUT NUTRIENT MANAGEMENT IN  GROUNDNUT,33 5   10
Farmers asked for groundnut seed rate,80
Ask about white grub control information in groundnut crop,EC
Farmer asked query on better to cultivation crop in rabi season,--The major oilseeds grown in the rabi season are groundnut rape seed mustard  sesame and castor
Farmer asked Larvae control information of groundnut,0    EC
Asking about Root rot management in groundnut,:      : :         25
asking about leaf roller management in groundnut,:       :  50 SP 15
FOR BETTER GROWTH OF GROUNDNUT,ADD GYPSUM 50 KG ACRE FOR BETTER GROWTH OF GROUNDNUT
Asking about drying of emerging shoots in groundnut,:    :         25
LEAF MINOR,Dimethiate 30 EC 400MLAC
SEED RATE OF GROUND NUT,SEED RATE OF GROUND NUT60 KG PER ACER
Ask about weed control information,targasupersuper 35gmpump spray
groundnut ke buvai kab kare,july me buvai kare
ASK ABOUT GENERAL INFORMATIONall information provided -,for calling in kisan call centre
Ask about groundnut information,8     WP
Asked about sucking pest management in groundnut,:       :    2
VARITIES OF GNUT,VARITIES OF GNUT - SB -11  TAG -24  WESTARN
Groundnut foliar spray management,recommended for the spray  groundnut rich  2 kg acre
insect,corajin
Attack of White Fly,Spray Metador 25 ml  15 lit of water
FARMER ASKED QUERY ABOUT WATER MANAGMENT IN GROUNDNUT,-           -                          -                         -
Asking about Leaf spot in Ground nut,Recommended for spray Carbendazim 2 gram litre of water
Attack of White Grub,Use Thimet 4 kgacre diethyl S- phosphorodithioatemvac
Fe def in ground nut,recommended to spray ferrous sulfate  20 grams per litre
Asked about need for groundnut booster,https:wwwtnauagricartcom
