QueryText,KccAns
groundnut atac welt,trikodarma4kg  par acar
pod borer in ground nut,spray chloropyriphus 2 ml in one litre of water for pod borer in ground nut
farmer want information about seed rate of groundnut,100          80
Farmer asked seed treatment of white grub control Groundnut crop,30  FS 3
APHID ATTACK IN GROUNDNUT,RECOMMENDED SPRAY DIMETHOATE 30EC 2MLLTR WATER FOR APHID ATTACK IN GROUNDNUT
ROOT ROT  IN GROUNDNUT,SAFF 2 GRAM PLANTOMYCINE 1 GRAM  1 LITER OF WATER
TELL ME CONTROL JHULSA IN GROUNDNUT,2
TELL ME CONTROL OF INSECT IN GROUNDNUT,USE IMIDACHLOPRID 178 SL 05 ML PER LITER WATER IN ROOT ZONE
TELL ME ABOUT INSECT CONTROL IN GROUNDNUT,25   4
STEM ROT PROBLEM IN PADDY CROP,RECOMMENDED TO SPRAY PROPICONAZOLE 200 MLACRE
ask about general information GNUT,--
Ask about fungus problem in crop,WP -
Asked about root rot disease management in Groundnut crop,:         :        25
thrips on groundnut,Spray Actra 5 gm redomil gold 30 gm 15 Lit of Water
ROOT GRUB,PHORATE GRNULES APPLICATION
Asked about Prevention of leaf spot disease for groundnut crop,:       :    200       1-2
ASKING ABOUT GROUNDNUT WHITE GRUB MANAGEMENT,GROUNDNUT WHITE GRUB MANAGEMENT   DUSTING OF MALATHION 5KGACRE
Farmer asked query on Weather,Weather forecast in Bargarh district at Bargarh block- There is possibilities of light to moderate rainfall for next four days with partly cloudy weather
varity of groununt,-- -
farmer ask larvae control in groundnut crop,1  SC      2           ZC      3    SC 7-8
Tikka leaf spot problem in groundnut crop,Recommended to spray mancozeb 400 gracre
ground nut white fly management,recommended for spray dimethoate 2 ml  lit of water
Asked about stem borer Attack,Spray Nuwan 20ml15Lit of Water
TEMITES  CONTROL IN GNUT,USE CHLOROPYRIFOS 20 EC 4 LITER PER HA WITH IRRIGATION
TELL ME CONTROL OF POD BORER IN GROUNDNUT,SPRAY OF ACEPHATE 75 SP 2 GM PER LITER WATER
TELL ME CONTROL OF CATTER PILLOR IN GROUNDNUT,DUSTING OF METHYL PARATHIAN 2 25 KG PER HA
insect in ukaliptus,Cartap Hydrochloride 4G10 Kgacre
pest infestation in ground nut,RECOMMENDED TO SPRAY MONOCROTOPHOSNUVACRAN 16 MLLT WATER
Rust control in groundnut,recommended for Spray carbendazim 1 gm lit of water
weed management in gnut at 50 days,recomended hand weeding
STEM ROT IN GROUND ROT,RECOMMENDED FOR SPRAY COPPER OXYCHLORIDE  3GML OF WATER FOR STEM ROT IN GROUND ROT
Information regarding to seed treatment in ground nut crop,seed treatment in ground nut-use of bavistin  25 gm per kg seed
ask about thrips and sucking pest problem in Groundnut,50 SC              SC
FARMER ASKED QUERY ON APPLICATION METHOD OF ZIPSUM,RECOMMENDED TO APPLY PLANT ROWS  BUT NOT NEAR TO PLANT DO NOT SPRAY ZIPSUM WITH WATER
mite management in groundnut,mite management in groundnut:RECOMMENDED TO SPRAY DICOFOL 1 LITRE  200 LITRES OF WATER ACRE
Ask for groundnut fertilizer information,I suggested not use fertilizer in groundnut at 45 DAS
ASKED ABOUT  NUTRIENT OF GROUNDNUT PLANT,:-    -           -
Farmer asked seed treatment of fungus problem in ground nut,DS
TELL ME DISEASE CONTROAL OF GROUNDNUT,SPARY OF KARBOFURON 4KGBHIGA
Ask about seed treatments for white grub control in,30  FS
ASKED   ABOUT INSECT CONTROL IN  GROUNDNUT,25   4
plant protection,no chemicals applied
ask about weed control in groundnut,-
Ask about fungus control information in root of Ground nut,-
Asked about Basal fertilizer management for Groundnut Oragnic farming,:    :   5     80     1    1
TELL ME ABOUT THE CONTROL OF INSECT IN GROUNDNUT,USE QUINOLPHOS 15 DUST 25 KG PER HA MIX IN SOIL
seed rate,125kgha
STEM ROT OF GROUNDNUT CROP,RECOMMENDED FOR SPRAY MANCOZEB 75 WP  25 GMLIT OF WATER
FARMER ASKED ABOUT TO SEED RATE OF GROUNDNUT,60  80
ASKING FOR  LEAF SPOT CONTROL IN GROUNDNUT,RECOMMENDED:SPRAY CARBENDAZIME 1GMLITRE
ASKED ABOUT TO NUTRIENT MANAGEMENT,5
yellowing of leaves,spray 25 ml microlla in 10 lts of water
ASKED ABOUT TO DISEASE CONTROL IN GROUNDNUT,1              25   4
TELL ME CONTROL TIKKA DISEASE IN GROUNDNUT CROP,SPRAY OF MENCOZEB 2 GM PER LITER WATER
TELL ME BLIGHT CONTROL IN GROUNDUTE,SPRAY OF COPPER OXICHLORIDE 45 GM  STREPTOCYCLIN 2 GM PER 15 LITER WATER
Caterpillars in ground nut crop,Recommended to spray Profenophos Cypermethrin  30 ml per 15 lit of water to control caterpillars in ground nut crop
Leaf curl,Leaf curl-spray confidor 1mlliter of water
Farmer asked fungus in root control information of groundnut crop,WP 35
TERMITE CONTROL IN GROUNDNUT,USE OF IMIDACLOPRID  250 MLBEEGHA IN GROUNDNUT
Farmer asked query on Weather,27      6     19
tikka leaf spot,spraying of mancozeb 2 g lit of water
Farmer asked fungus control information of groundnut,SC 20
FARMER ASKED ABOUT CONTROL APHID ON GROUND NUT,-
PLANT PROTECTION,SPRAY SAFF 2 GML OF WATER
Farmer asked fungus in root control information of ground nut crop,EC -
Farmer asked fungus in root control information of GROUNDNUT,WP           Ridomil Gold Syngenta
Ask about white grub control information in Groundnut,GR 15
farmer ask about groundnut sowing time,-   -
GROUNDNUT ROOT GRUB PRECAUTION MANAGEMENT,recommended to apply basal dose single super phosphate 100 kg acre
TELL ME CONTROL COLAR ROT DISEASES OF GROUNDNUT,USE-TRAICODRMA 25 KILOGRAM100KILOGRAMHACTIYAR
Farmer asked Army worm Problem in groudnut crop,SC 8-10
groundnut weedicide,groundnut weedicide   - alaclor 1 kilo ekar
asking about caterpillar and Aphids management in groundnut,Recommended for spray profenophos 2 ml  acephate 1g  lit of water
Farmer asked fungus control information of groundnut,WP    WP Nativo
TOBACCO CATERPILLAR PROBLEM IN GROUNDNUT CROP,RECOMMENDED TO SPRAY CHLORIPYRIPHOS 500 MLAcre
ASKED ABOUT TO NUTRIENT MANAGEMENT IN  GROUNDNUT,-- 20
groundnut varities,groundnut varities - sb-11
Ask about general information,All information provided thanks for calling in kisan call center
WEED CONTROLL IN GROUNDNUT,RECOMENDED TO SPRAY TARGA SUPER 2MLLITER WATER FOR WEED CONTROLL IN GROUNDNUT
WEED CONTROL,ALACHLOR 3L1000LIT
Rain Inquiry,No rain fall data upto 2 july
TELL MEWHIT GRUB CONTROL IN  GROUNUT  NUT,USE QUINOLPHOS 25 EC 4 LITER PER HA WITH IRRIGATION FOR CONTROL OF WHITE GRUB
TELL ME NUTRIENT MANAGEMENT,05     01
WEATHER REPORT OF GAZOLEMALDAH,CLOUDY SKY WITH POSSIBILITY OF LOW TO MEDIUM RAINFALL IN NEXT FIVE DAYS
LEAF CATTER PILLAR IN GROUNDNUT,RECOMMENDED FOR SPRAY CHLOROPYRIPHOUS 2ML LIT WATER FOR CONTROL OF LEAF CATTERPILLAR IN GROUNDNUT
Asking about Leaf caterpillar and root rot disease management in groundnut,:            :   2    2       1
LEAF SPOT IN GROUNDNUT,RECOMENDED TO SPRAY MANCOZEB 3GMLITER WATER TO CONTROLL LEAF SPOT IN GROUNDNUT
FARMER ASKED ABOUT ATTACK OF LEAF EATING CATERPILLAR ON groundnut,70
Farmer asked query on Weather,Weather forecast in Balangir District at Agalpur  Block- There is possibility of little   rainfall for tommorowno rainfall thereafter  partly cloudy  weather may remain
Farmer asked Thrips problem in groundnut crop,WG -
Asked about top dressing fertilizer application for Groundnut,:        :       45        80
Farmer asked query on Weather,:   -     : :            34  C    26 C     6
TELLL ME WHITE GRUB CONTROL IN GROUNDNUT,USE QUINOLPHOS 25 EC 4 LITER PER HA WITH IRRIGATION FOR CONTROL OF WHITE GRUB
ASKED ABOUT TO INSECT CONTROL IN  GROUNDNUT  CROP,40   4    15
groundnut caterpillar,profex super35ml15lit watar
topdressing fertilizer management for groundnut,apply  gypsum150 kg acre
Asked about management of tobacco caterpillar and leaf miner in groundnut,:            :  Flubendiamide   10
TELL ME ABOUT NUTRIENT MANAGEMENT,USE CARTAP  HYDROCHLORIDE 3 KGHAC WITH IRRIGATION
Farmer asked query on Weather,BARMER                  -
Gnut fertilizer,1 bag urea Acer
ground nut tabacco caterpillar,RECOMMENDED TO SPRAY MONOCROTOPHOS 400 ML ACRE
pest management of Groundnut,Recommended for contact to agricultural officer in assistant director of agriculture
Fertilizer dose for Groundnut,---                                                   -                    -
TELL ME WHITE FLY CONTROLM IN GROUNDNUT,SPRAY OF TRIZOPHOS 40 EC 2 ML PER LITER WATER
preventive measures for controlling  sucking pest on groundnut,spray neem ark 30 ml  15 liter of water for  controlling  sucking pest on groundnut
asked groundnut,RECOMMENDED TO SPRAY QUINOLPHOSEKALUX FLASH DHANULUXQUINGUARD 400 ML PER ACRE
Farmer asked query on Weather,29       6     4
Asking about Groundnut Top dressing fertilizer management,Recommended to apply Urea 6 Kg  Potash 12 5 Kg   acre
ask about control of white grub in groundnut,metasoft chas ma aapvu
CONT OF TERMIT IN GROUNDNUT,YOU SHOULD BE APPLY FIPROLIN 1LIT PER HACTER
Asked for the control of the sucking pest in cotton,Apply the Immida  Acifat
ASK ABOUT FERTILIZER MANAGEMENT IN GNUT,I suggested do not apply any fertilizer management in gnut
wilting of groundnut crop,you can spray redomil gold 30 grampamp water use for wilting of groundnut crop
GROUND NUT WILTING,APPLY SAFF 2GM LT WATER SPRAY
MARKET INFORMATION,GIVE MARKET INFORMATION
Farmer asked weed control in groundnut crop,80    -            -- 9  EC    -     -
TELL ME ABOUT TERMITE CONTROL IN,20   4
ask about control of leaf spot,i suggested spray mencozeb 25 gram 10 li Water
MOUSE,ALLUMINIUM PHOSPHIDE
HIGH YIELDING VARIETIES OF GROUND NUT,RECOMMENDED VARIETY KADIRI-9
TELL ME ABOUT BLACK LEAVES  DISEASE CONTROL IN  GROUNDNUT,1  5
farmer asked about fertilizer spray for groundnut crop,-            30
ask gnut leaf spot,i suggest contaf m-45 sprey 35gmpump
Farmer asked Seed rate and Spacing information of Groundnut crop,- -      -    -     -    18
Ask for groundnut sowingtime information,groundnut sowingtime  :third and fourth week of January month
farmer want to know information about How to control weeds in GROUNDNUT crop,emejhathayper 300 ml per acar for broad leaf weeds
TELL ME ABOUT PEST IN GROUNDNUT,TELL ME PEST CONTROL IN COTTON TRIZOFOS 25 ML PER LITRE WATER SPRAY
farmer asked query on use of propineb,Propineb 70  WP Specifications: Antracol contains Propineb a Contact Systemic Fungicide with broad-spectrum activity against various diseases
Asked about organic pest repellents information,:      :
Farmer asked query on Fertilizers  management in GROUNDNUT,RECOMMENDED TO APPLY GYPSUM 200 KGSACRE
Information about spacing of ground nut,3010
reddish leaves in ground nut due to potassium deficiency,Advised to apply MOP 15 kg per acre in ground nut
leaf eating catterpiller groundnut,SPINOSADTRACER SPINTER  CHARGE   75 ml PER ACRE
FARMER ASKED ABOUT TTACK OF SUCKING PEST ON GROUNDNUT,-   200
GROUND NUT STEM ROT  POD ROT,RECOMMENDED TO SPRAY CHLOROTHALANILKAVACH DACONIL BRAVO  400 GRAMS PER ACRE
Hadda beetles in Ground nut,QUINALPHOS 25 EC
Ask about flower problem in Groundnut crop,::
Asked about Nutrient management in groundnut,Apply gypsum  160 kgacre
g nut variety,western 20 ya bhumugachi lagavd karavi
Asking about Groundnut top dressing fertilizers,Recommended for apply gypsum - 75 kg  Borox - 4 kg acre
Farmer asked query on Weather,BHOPALSAGAR
asked about groundnut seed treatment,apply raizobium organic
Tobacco caterpillar control in groundnut,recommended for spray profenophos 2 ml  acephate 1 g  liter of water
ground nut root rot management,RECOMMENDED  TO DRENCH MANCOZEB  3 GRAMS  1 LITRE OF WATER
protection,difenicizole 1mlltr
TELL ME FANGUS CONTROL OF GROUNDNUT,DRENCHING OF CARBENDAZIM 250 GRAM PER BHIGA WITH URIA
Yellowing of leaves,spray mancozeb 2gmliter water
TELL ME CONTROL COLLOR ROT IN GROUNDNUT,25  100
GROUND NUT POD BORER,RECOMMENDED SPRAY THIODICARB 300GACRE
Farmer needs information regarding storage of groundnut,I
asking abt the rainfall,i have givn that there is little rain inthis week
TELL ME ABOUT DISEASE  CONTROL IN  GROUNDNUT,-- 1
Asking about Stem rot control in Groundnut,:     :   5
Ask about a larvae pest problem in groundnut,SCSG               EC 30
GROUNDNUT VARIUETIES,RECOMMENDED FOR GROUNDNUT VARIETIES VEEMANAGL-24 NARAYANIK-4K-6KALAHASTHI GRESHMA ARE SUITABLE
WEEDS IN GROUNDNUT,SPRAY TARGA SUPER 2ML1 LITRE WATER TO CONTROL WEEDS IN GROUNDNUT
Asking about weather forecast,-
water management of groundnut,timely irrigation require
variety in groundnut,variety in groundnut - kaushal  chitra ambar prakash
ASKING ABOUT ATTACK OF WILT IN GROUNDNUT,:-                  2-25
TELL ME  SOIL TREATMENT IN SOWING TIME IN GROUNDNUT,USE TRICHODERMA 25 KG PER 100 KG FYM
TELL ME COLAR ROT DISEASE CONTROL IN GROUNDNUT,TRICODERMA 25 KGHECTAR IN FYM 100
Aphids management in groundnut,Recommended for spray Dimethoate 2ml  lit
The farmer asked about the ripening period of peanuts,2-3                          4-5
YELLOW LEAF IN GROUNDNUT,2 GRAM STRAPTROCYCLINE  45 GRAM COPPEROXCICLORIED PER 16 LITER TANKI WATER SPREY
Asked about Nutrient management in  groundnut,Recommended to Apply  Gypsum and Micronutrients
Farmer asked leaf spot control information of groundnut crop,EC 10
Farmer asked query on Weather,:                        35           9
THIKKA DISES OF GROUND NUT,COPPER OXY CHLORIDE BLITOX 600 GRAMS PER ACRE
ask for water,give information
Time of irrigation in groundnut,Recommended to go for sprinkling of water to enable the germination of top groundnut seeds remaining on surface soil
Farmer asked query on Weather,:       :                  31     22      6
Ground nut sowing season,Recommended for season April-May
SEED RATE OF GROUND NUT,RECOMMENDED SEED RATE 40KGS ACRE
Ask about general information,Ask about general information
asking about Coimbatore district groundnut season details,recommended for Chithiraipattam April-May  Anippattam June- July
FARMER ASKED ABOUT VARIETY OF GRAM,:-
Asking about Leaf caterpillar and Sucking pest management in groundnut,Recommended for Spray Chlorpyriphos 2 ml  Acephate 05 gram litre of water
Asked about groundnut cater pillar management,:        :    8   10
TELL ME ROOT ROT CONTROL IN GROUNDNUT,--
Asking fertiliser in groundnut,advise- 125-25kgNPha
ASKED ABOUT ATTACK OF SUCKING PEST AND FUNGUS ON GROUNDNUT,FOR CONTROL OF SUCKING PEST AND FUNGUS ON GROUNDNUT  - SPRAY SAAF 30 GM    ADMIRE 5 GM 15 liter water BAYER CROP SCIENCE
TELL ME NUTRIENT MANAGEMENT IN GROUNDNUT,SPRAY OF FERUS SULPHATE 5 GM PER LITER WATER
TELL ME GROUNDNUT SEED RAT,GROUNDNUT SEED RAT -80-100KG
ask about weed management,imizathepar 10 SL
Asking about Leaf caterpillar management in groundnut,Recommended for sprayProfenofos  2 ml  neem oil 3 ml  sticking agent 1 ml  litre of water
TELL ME TRUMDI CONTROL,termite control in groundnut choloropyrifos 20 ec 1 litre prati bigha with irrigation
Farmer asked query on Weather,-                 34   29
USE OF RHIZOBIUM CULTURE IN GROUDNUT,RHIZOBIUM CULTURE-20ML40ML WATER1 KG SEEDS
GROUND NUT LEAF SPOT,recommended to spray SAAF CARBENDAZIM   MANCOZEB  400 gm  acre
TELL ME  BLACK ROOT ROT CONTROL IN GROUNDNUT,DRENCHING OF CARBENDAZIM 250 GMBIGHA IN ROOT ZONE WITH IRRIGATION
ROOT PROBLEM OF GROUNDNUT,BLACK ROT CONTROL IN GROUNDNUT USE TRIGODRAMA 25 KG WITH 100 KG FYM  PER HA
GROUND NUT LEAF EATING CATERPILLAR MANAGEMENT,RECOMMENDEDTO SPRAY EMMAMACTIN BENZOATE 90 GRAMSACRE IN 200 LT WATER
TELL ME WEATHER REPORT IN SIKAR,NO RAIN POSSIBILITY IN NEXT 3-4 DAYS BUT CLOUDY SKY
Ask about nano urea,40
TELL ME ABOUT WEATHER INFORMATION,NO RAIN POSSIBILITY IN NEXT 2 DAYS BUT CLOUDY SKY
TELL ME SUCKING PEST CONTROL IN GROUNDNUT,SPRAY OF DIMETHOATE  30 EC 2 ML PER LITER WATER
Asking about Fish Acid Foliar Application,:        : 10   200
caterpiller,profex super
Asked about Groundnut Seed Germination information,:      :    5  10
GROUNDNUT PEST,SPRAY QUNOLFOS 1ML2LT OF WATER
Farmer asked Larvae control information of Groundnut Crop,SG  10
Information regarding control of root borer in groundnut,3    1
asking about root grub control in groundnut,recommended for Apply carbofuran 5kg ac
information about of termite control in Groundnut crop,3  GR  8-10
mungfali me phool kam aa rahe hai,boom flower 15mlliter paani me mila kar spray kare
Ask about blank pod in  and ground nut,100
TELL ME INSECT CONTROL OF SOYABEAN,DUSTING OF METHYL PARATHIAN 2 25 KG PER HA
first irrigation of groundnut,first irrigation 25 days after sowing time
UPCHAR IN GROUNDNUT,2 GRAM KARBANDAZIMKG  3 GRAM CLOROPIROPHOSEKG 600 GRAM RIZOBIUM CULTURE
Asking about groundnut thrips management,Recommended for spray dimethoate 2mllitre of water
TELL ME VARITIES OF GROUNDNUT,VARITIES OF GROUNDNUT TG-37 AJL-24
ROOT ROT IN GROUND,DRENCHING OF CARBENDAZIM 1 KG PER HA WITH IRRIGATION
DOSE OF GYPSUM IN GNUT,300 kgacre at flowering stage
Asking about Groundnut foliar spray application,:       :   5      3     1
TELL ME MICRONUTRIAENT IN GROUNDNUT,SPRAY OF WETTEBLE SULPHUR 80 WDG 2 GM PER LITER WATER
top dressing in groundnut,apply gypsum 150kg ac
GROUNDNUT WEED CONTROL,: Fluchloralin 20 lha applied through flat fan nozzle with 900 l of waterha
Asking about Groundnut rich and Pesticide can be mixed,:        :    3
asking about groundnut foliar application,Recommended for groundnut foliar spray TNAU Groundnut rich 2kg  acre  200 litres of water
dose,spray of 0:52:34  microla
Ask about Fungus control in ground nut crop,:    1000
Farmer Asked sucking pests control information of Groundnut Crop,EC 30
Farmer asked query on Weather,3   9                    2 C    3 C      4
asking about white grub control in groundnut,recommended for apply BANNARI BEAUVEMETBRONGNIARTII
top dreesing fertilizer management for groundnut,apply gypsum 150 kg ac
Asking about leaf miner management  in groundnut,:     :      2
Farmer wants to know information about weed control in groundnut crop,35
INSECT CONTROL,SPRAY OF INDOXACARB 145 SC 1 ML PER LITER WATER
groundnut nutriend deficiency,foliar spray zinc sulphate 5 gmlit
BLACK SPOT,Blue copper -40 gm 15 lit water
FARMER ASKED ABOUT SPRAY FOR GROWTH ON GROUNDNUT CROP,:: -
ASKED ABOUT THE DOSAGE OF EMAMECTIN BENZOATE AND CAN BE MIXED WITH OTHER PESTICIDE OR FUNGICIDE,RECOMMENDED 045GMSLITER OF WATER AND NOT TO MIX WITH OTHER PESTICIDES OR FUNGICIDES
Farmer asked Heliothis Larvae Problem in g nut  crop,40
frist irrigation of groundnut,15 day after sowing time
FERTILIZER DOSE,Urea 1 Bag  Single Super Phosphate 75 Kg  Micro Nutrients 10 KgAcre
TELL ME POD BORER IN GROUNDNUT CROP,SPRAY OF INDOXACARB 145 SC 1 ML PER LITER WATER
TELL ME TERMITE CONTROL IN GROUNDNUT,USE IMIDACHLOPRID 178 SL 15 LITER PER HA WITH IRRIGATION FOR CONTROL OF TERMITE
TELL ME CONTROL OF FUNGS,SPRAY OF CARBENDAZIM 12  MANCOZEB 63 WP 2 GM PER LITER WATER
Information regarding weather in sirsa,Information regarding weather in sirsa Some clouds and chance of rain fall today
asked about fertilizer dose,apply urea 25 kg  ssp 50 kg  acre
g nut yellowing leaf control,spray hirakachi powder 100 gm 10 gm citric acid
Ask about weed management in groundnut crop,Paraquat Dichlride 24 SL 300 ml acer
Asked about Alternaria leaf disease management in Groundnut,:         :   2    1
G NUT SOWING FERTILIZER SEED RATE,Seed rate: 40-48 kg per acre to Boni
Farmer wants to know information about weather,chance of rainfall in your district at next 5 days
ROOT PROBLEM OF GROUNDNUT,USE TRICHODERMA 25 KG PER 100 KG FYM
LEAF ETING CATER PILLARS IN GROUND NUT,RECOMMENDED TO SPRAY EMAMECTIN BENZOATE  90 GRAMS 200 LITRES OF WATER  ACRE
Asking about Groundnut top dressing fertilizer for 45 DAS,:  45    :   - 75     - 4
gronund nut top fertilizer management,recommended for apply gypsum 75 kg  acre
Asking about Groundnut tobacco caterpillar management organic method,:      :        3        1
Asking about tobacco cut worm and leaf miner management  in Groundnut,:          :      2
Farmer asked about seedrate of groundnut,seedrate of groundnut   100 Kg Hec
Farmer asked fungus control information of  groundnut crop,EC 10
attack of white grub in groundnut,give phoret 4 kg  acer for controlling white grub in groundnut
TELL ME SOWING TIME OF GROUNDNUT,1 APRIL TO 20 APRIL SOWING TIME OF GROUNDNUT IN CHURU REGION
Time of sowing of ground nut,Time of sowing of ground nut- from 15 June 10 July
INFORMATION REGARDING HOW TO CONTROL WEED IN GROUNDNUT CROP,NO WEEDICIDE USED
ASKING ABOUT THE CONTROL OF ROOT ROT IN GROUNDNUT,SPRAY AZOXYSTROBIN 23 SC  1 ML   LIT OF WATER
ground nut seed,tag 24 western 51  ya bhumugachi lagavd karavi
CATERPILLER IN GROUNDNUT,SPRAY QUINALPHOS 2 MILI LITRE PER LITRE WATER OR SPRAY CHLORPYRIPHOS 2 MILI LITRE PER LITRE WATER TO CONTROL CATERPILLER IN GROUNDNUT
Farmer asked weed control in Ground Nut crop,16        EC  40      -
asked about nutrient for groundnut,nutrient for groundnut -Spray Actra 5 gm15 Liter of WaterThiomithoxom 25-Syngenta
Asking about thrips management in groundnut,:   :
ASKED ABOUT TO BACTERIAL BLIGHT DISEASE IN GROUNDNUT,259   1
Asked about plant protection in groundnut,Suggested to Spray:- Mancozeb  2glit of water
varieties of groundnut,varieties of groundnut - TAG 24 SB 11
groundnut basal  fertilizer,apply DAP 50 kg  ac
top dressing  fertilizer management for  groundnut,apply gypsum 150 kg ac
Asked about variety,Variety- Phule Unap SB-11 TAG-24
Gram pod borer in groundnut,Recommended for Spray chloropyriphos 2mllit of water
GROUNDNUT ZINC DEFICIENCY MANAGEMENT,RECOMMENDED TO SPRAY ZINC SULPHATE  2 GRAMS  1 LITRE OF WATER
plant protection in ground nut,Trichoderma viride 4 kilogramhectare 50 kilogram gobar ki khad me milakar khet me bakhere
TELL ME ABOUT THE CONTROL OF WEED IN GROUNDNUT,--         25          -
TELL ME WEATEHR INFORMATION OF JAISELMER DIST,NO RAINFALL NEXT FIVE DAYS
asked about weed management in Groundnut,:       :   30
FARMER WANT TO HOW TO CONTROL FUNGGAL ATTACK IN GROUNDNUT,Spray of Metalaxyl-8  Mancozeb-64 WP Ridomil or UNILAX  30 gpump
Farmer asked fungus in root control information of Groundnut Crop,EC
Weather information,There is a possibility of light rain in your area this week till august 15
VARIETY OF GRNUT,VARIETY OF GRNUT -SB 11 TAG 24
CHARCOL IN GROUNDNUT,BAVISTIN 250 GRAM PER BHIGA USE
Farmer wants to know information about How to control of fungal attack in ground nut crop,Recommended for to control of fungal attack spray carbandazim  mancozeb 40gmpump and streptocyclin 2 gram at 15 liter of water
Asking about weather forecast,Todays weather Partly cloudy and no Possibility of Rainfall
ASKING ABOUT DETAILS OF  MALEIC HYDRAZIDE,ALPHA NAPHTHYL ACETIC ACID
TELL ME VARIETY OF GROUNDNUT,VARIETY OF GROUNDNUT -RS-1M-13MA-10
Asked about tobacco caterpillar management in Groundnut,:     :      1
Asked about Weed management in groundnut,Recommended to take hand weeding after 30days of sowing in groundnut
ask abt fertdose,i have sugested DAP
Ask about larvae control informationSuggested:,Cypermethrin 10EC 15 mlpump spray
asking for the pest management in groundnut,recommended for the spray of profenophos at the rate of 2ml in 1 litre of water
FARMER ASKED THE VARIETY OF GROUNDNUT,2
Asked about Leaf eating Caterpillar management in Groundnut,:      :  1    1
TELL ME SEMILOOPER CONTROL,DUSTING OF METHYL PARATHION 2 POWDER 25 KGHAC
groundnut leaf spot management,RECOMMENDED TO SPRAY PROPICONAZOLE TILT 200MLACRE
Farmer asked fungus in root control information of GROUNDNUT crop,WP
Asking about Groundnut leaf blight management,:      :   - 4
TELL ME ABOUT INSECT CONTROL,5   05
Asked about white grub management in groundnut,:          :     1  20
weather information,apke kshetra me es saptah 10 july tak boonda-baandi ki sambhavna hai
yield increase in groundnut,recommended for spray Groundnut rich 2kgac200 lit of water
Asking about groundnut top dressing fertilizer application,Recommended for apply micro nutrient mixture 5 kg  acre
Weather information,Thiophanate-methyl 70 WP 2 gram1 li pani me spray kare
ground nut tobaco caterpiller,RECOMMENDED TO USED CHLORIPYRIPHOS 6MLLITRE FOR ROOT DRENCHING for ground nut tobaco caterpillar
Farmer ask about fruit quality and growth of groundnut crop,00-00-
TELL ME WEEATHER INFORMATION,NO RAINFALL NEXT FIVE DAYS
ask about the pink ball worm in cotton,I suggested quinalfos 20mili in 10 litre of water
TELL ME WEATHER CONDITION IN JALANDHAR DIST,CLEAN WEATHER WILL BE FOR NEXT 5 DAYS
WEATHER REPORT OF MAYURBHANJ,NO RAINFALL ON NEXT 5 DAYS IN MAYURBHANJ
sprinkler subsidy availability details,contact to  block level agri engg dept
TELL ME MICRO NUTRIENT MANAGEMENT IN GROUNDNUT,SPRAY OF ZINK SULPHATE  5 GRAM UREA 10 GRAM PER LITER WATER
Asking about leaf minor management in groundnut,:     : :      15
TELL ME ABOUT VARIETY OF CHILLI,VARIETY OF CHILLI  RCH 1 NP-46 PUSA JWALA MATHANIA LONG PANT C 2
Farmer asked Fertilizer dose information of Groundnut crop,-    80    - 90
TELL ME ABOUT INSECT CONTROL IN GROUNDNUT,--     250
TELL ME  SEED TREATMENT  IN  GROUNDNUT,USE CHLOROPYRIFOS 20 EC 4 ML PER KG SEED FOR SEED TREATMENT IN GROUNDNUT
asked about varieties of groundnut,-  -  -    --     ------ -- -   westarn - 51
STEM ROT,THIRAM 3GM1LIT WATER DRANCH SOIL
GROUNDNUT STEM ROT MANAGEMENT,RECOMMENDED TO SPRAY HEXACONAZOLE 2 ML PER LITRE OF WATER
Asking about Rust management in groundnut,Recommended for spray Pseudomonas fluorescens 10gm  lit
Ask about nutrient management in Groundnut crop,::
root rot in groundnut,spray sixer 3g1lit water-root rot in groundnut
Farmer asked query on Weather,0      6     4
fertilizer management in groundnut,recommended to apply urea 25 kg acre
ASKED ABOUT TO SEED RATE OF GROUND NUT,-60 80
FERTLIZER APLLYTION TIME IN GROUND NUT,FERTLIZER APLLYTION TIME IN GROUND NUT CALL WAS DISCONNECTED
TELL ME BLIGHT CONTROL IN GROUNDNUT,SPRAY OF COPPER OXICHLORIDE 45 GM  STREPTOCYCLIN 2 GM PER 15 LITER WATER
TELL ME VARIETY OF MUSTARD,VARIETY OF MUSTARD -GIRIRAJ
Asked about plant protection,Recommended to spray IMIDACHLOPRID 8mL per 16lit
Ask about crop variety information,June-July Jan-Feb
Farmer asked growth problem in groundnut crop,15  20
GROUND NUT APHID,RECOMMENDED TO SPRAY DIMETHOATE  2ML   LITRE OF WATER RECOMMENDED TO SPRAY ACEPHATE 15 GRAMS   LITRES OF WATER
Asking about rat management for groundnut field,: :                  2    - 95    2   1
termite control in ground nut,cloropyriphos 20 ec  1 liter acre
